Utterance_ID,Text,Emotion
Ses05F_script03_2_M013,you neednt be so grand simply because you dont happen to want any at the moment,ang
Ses05F_script03_2_M014,really amanda,ang
Ses05F_script03_2_F014,just making myself fascinating for you,neu
Ses05F_script03_2_M016,oh that reply has broken my heart,ang
Ses05F_script03_2_M019,its a pity you didnt take a little more brandy it might have made you a little less disagreeable,ang
Ses05F_script03_2_F018,um it doesnt seem to have worked such wonders with you,ang
Ses05F_script03_2_F019,adder dont snap they sting,ang
Ses05F_script03_2_F020,they sting,ang
Ses05F_script03_2_M022,they snap,ang
Ses05F_script03_2_F021,i dont care if they bark and roll around like hoops okay,ang
Ses05F_script03_2_M024,did you see much of peter burden after the divorce,ang
Ses05F_script03_2_F022,yes i did quite a bit,neu
Ses05F_script03_2_M025,i suppose you let him kiss you a good deal more then,ang
Ses05F_script03_2_F023,mind your own business,ang
Ses05F_script03_2_M026,you must have a riotous time no restraint at all very enjoyable i mean you never had much anyway,ang
Ses05F_script03_2_F024,oh dear you really are becoming quite insufferable i would imagine its because youre drunk,ang
Ses05F_script03_2_F027,not very funny dear you better have some more brandy,ang
Ses05F_script03_2_F029,why,ang
Ses05F_script03_2_F030,there arent any people upstairs its a photographers studio,ang
Ses05F_script03_2_F031,theyre away in tunis,ang
Ses05F_script03_2_F032,turn it on again,ang
Ses05F_script03_2_F033,fine if you insist on being completely insolent,ang
Ses05F_script03_2_M037,turn it off it is driving me mad,ang
Ses05F_script03_2_F034,well do try to control yourself darling,ang
Ses05F_script03_2_M038,turn it off,ang
Ses05F_script03_2_F035,you really do need to develop uh a clearer head,ang
Ses05F_script03_2_M039,turn it off,ang
Ses05F_script03_2_F036,i i hate you,ang
Ses05F_script03_2_M040,amanda listen listen,ang
Ses05F_script03_2_F037,i hate you,ang
Ses05F_script03_2_F038,no no im tired of listening to you youre boorish and idiotic and completely overbearing,ang
Ses05F_script03_2_M041,very music amusing indeed,ang
Ses05F_script03_2_F039,yeah very amusing let me go im getting out of here i cant believe i intended to marry you,ang
Ses05F_script03_2_M042,you are a vile tempered loose living wicked little beast and i never want to set eyes on you again,ang
Ses05F_script03_2_F040,oh marry you again i must have been insane what was i thinking i mean youre completely outrageous,ang
Ses05F_script03_2_M043,shut up shut up i wouldnt marry you again if you came crawling to me on bended knee youre a mean evilminded little vampire and i hope to god i never set eyes on you again,ang
Ses05F_script03_2_F041,beast brute cad whore,ang
Ses05M_impro07_M000,guess what,hap
Ses05M_impro07_F000,what,hap
Ses05M_impro07_M001,i got it i got accepted to usc,hap
Ses05M_impro07_F001,oh for real,hap
Ses05M_impro07_M002,yes i just found out today i just got the letter,hap
Ses05M_impro07_F003,ohim so glad,hap
Ses05M_impro07_M003,i know i know im so excited,hap
Ses05M_impro07_F004,what are you gonna study,hap
Ses05M_impro07_M004,oh theater yeah yeah,hap
Ses05M_impro07_F005,really are you doing the mfa program,hap
Ses05M_impro07_M005,yes,hap
Ses05M_impro07_M006,oh,hap
Ses05M_impro07_F007,i heard its so tough to get into,hap
Ses05M_impro07_M007,its exactly what i wanted,hap
Ses05M_impro07_F008,thats awesome,hap
Ses05M_impro07_M009,i worked really hard ill say i worked really hard you know i im not bragging or anything like that but,hap
Ses05M_impro07_F009,yeah thats awesome,hap
Ses05M_impro07_F010,no,neu
Ses05M_impro07_F011,uh huh yes seriously for years,hap
Ses05M_impro07_M011,finally im so excited were gonna  well ill be here were still gonna be able to see each other,hap
Ses05M_impro07_F012,i know i know im im definitely  i realize laughter,hap
Ses05M_impro07_M013,what are you wait what are you doing,hap
Ses05M_impro07_F013,um im gonna be studying at usc too,hap
Ses05M_impro07_M014,perfect oh my god are you staying are you going to live on campus,hap
Ses05M_impro07_F015,yeah totally well where are you going to live,hap
Ses05M_impro07_M016,we are gonna have a great time,hap
Ses05M_impro07_M017,garbage im going to live on campus i mean well around campus anyway yeah housing around campus,hap
Ses05M_impro07_F016,oh yeah,neu
Ses05M_impro07_F017,good tradeoff,neu
Ses05M_impro07_M018,i just want to be really close to things you know i know its not exactly the best neighborhood in the entire world but uh,hap
Ses05M_impro07_F018,i dont i dont think its that bad,neu
Ses05M_impro07_M019,i dont you know i feel the same way you know what i mean and everybody says a lot of other crap you know they dont know what they are talking about anyway,hap
Ses05M_impro07_F019,yeah,neu
Ses05M_impro07_M020,they dont live here they dont know right,hap
Ses05M_impro07_F020,yeah i think its really also if you if you consider yourself like us and them kind of thing if you think youre part of your community then you going to like it more,neu
Ses05M_impro07_M021,yeah,hap
Ses05M_impro07_M022,exactly you make it what you make it you know right and im gonna make it so freaking awesome,hap
Ses05M_impro07_F021,right exactly,hap
Ses05M_impro07_F022,oh im so glad,hap
Ses05M_impro07_M023,yeah,hap
Ses05M_impro07_F023,so when do you know like where youre gonna live and,hap
Ses05M_impro07_M024,well i dont know ive got to go look for a place,hap
Ses05M_impro07_F024,oh wow,neu
Ses05M_impro07_M025,yeah yeah i i dont i dont know do you have any suggestions,hap
Ses05M_impro07_F025,um,neu
Ses05M_impro07_M026,you know the area better than i do,hap
Ses05M_impro07_F026,yeah i mean i know i know like the the housing surrounding the campus pretty well,neu
Ses05M_impro07_F027,um how many people do you want to live with,neu
Ses05M_impro07_M028,not a lot i mean i wouldnt want to live with more than three other people so like four of us total right,hap
Ses05M_impro07_F028,all dudes,neu
Ses05M_impro07_M029,i dont care i dont care,hap
Ses05M_impro07_F029,um i think i have some friends,neu
Ses05M_impro07_M030,yeah,hap
Ses05M_impro07_F030,yeah,neu
Ses05M_impro07_M031,that would be perfect,hap
Ses05M_impro07_F031,theres actually a friend of mine is um moving out of her place and her place is amazing and its really cheap,hap
Ses05M_impro07_M032,really,hap
Ses05M_impro07_M033,really,hap
Ses05M_impro07_F032,yeah,neu
Ses05M_impro07_M034,cheap is exactly what i need because i have no money at all,hap
Ses05M_impro07_F033,okay,neu
Ses05M_impro07_M035,but uh,hap
Ses05M_impro07_M036,loans scholarships ive got a lot of scholarships yeah yeah im im half native american so i get all those scholarships too yeah,hap
Ses05M_impro07_F035,youve got a lot oh awesome,hap
Ses05M_impro07_F036,oh cool,hap
Ses05M_impro07_M037,so it comes indian like and you know im kind of smart so,hap
Ses05M_impro07_F037,yeah,hap
Ses05M_impro07_F038,totally,neu
Ses05M_impro07_F039,good for you,hap
Ses05M_impro07_M039,and yeah well i mean basically i just applied for any and every possible scholarship and grant that could come by so i can go,hap
Ses05M_impro07_F040,the way to do it,neu
Ses05M_impro07_M040,yeah yeah yeah and its gonna work out im gonna be able to pay for it im gonna go i mean ill have a little debt in the end but i dont care,hap
Ses05M_impro07_F041,wow are you so excited,hap
Ses05M_impro07_M041,its just you know a dream come true how could you not be excited about a dream come true,hap
Ses05M_impro07_F042,youre gonna be so busy too youre going to have to work so hard,hap
Ses05M_impro07_M042,oh i know i know,hap
Ses05M_impro07_M043,but im so looking forward to being so busy you know what i mean its the kind of busy youve got to love right,hap
Ses05M_impro07_M044,because youre doing something you love thats the kind of busy you want i want to be able to do that for the rest of my life be that kind of busy,hap
Ses05M_impro07_F044,all right wow so exciting,hap
Ses05M_impro07_M045,i had to tell you right away i knew youd be excited,hap
Ses05M_impro07_M046,well have fun,hap
Ses05M_impro07_F045,yeah well have so much fun,hap
Ses05M_impro07_M047,great okay,hap
Ses05F_impro08_F000,hi sir how can i help you,neu
Ses05F_impro08_F001,okay,neu
Ses05F_impro08_F002,laughter all right im sorry sir that youve been having a hard time,neu
Ses05F_impro08_M004,this is ridiculous i i seriously i dont understand why you think these automated systems are supposed to like work for anybody they have never ever work for me,ang
Ses05F_impro08_F003,i kwon it is ridiculous,neu
Ses05F_impro08_F004,yeah i understand,neu
Ses05F_impro08_M005,can you like talk to somebody about this can you like can you tell them that this is ridiculous and can they change it from now on is there a phone number you have that i can call that will like automatically be talking to somebody a human being,ang
Ses05F_impro08_F005,uh whens whens,neu
Ses05F_impro08_F007,if yeah well if you just slow down well um well definitely have your problem solved and after we have your problem solved then i can transfer you to a manager someone who can you know you can voice your complaint to who will be able to something about it,neu
Ses05F_impro08_M007,like i know i paid last month but it hasnt been paid and you charged me a late fee,ang
Ses05F_impro08_F008,okay so where okay all right so where did you uh locate your your bill,neu
Ses05F_impro08_F009,in the mail,neu
Ses05F_impro08_F010,so is it is is it at all possible that maybe this statement is just old and that the transaction hadnt been processed yet,neu
Ses05F_impro08_F011,okay,neu
Ses05F_impro08_F012,okay,neu
Ses05F_impro08_F014,okay so ill just look it up and you know see whats going on maybe we can,neu
Ses05F_impro08_F015,if i call it up on the screen,neu
Ses05F_impro08_M013,okay great go ahead,neu
Ses05F_impro08_F016,so in the database it looks as though um there is a there is like a glitch in the transaction where it hadnt gone through before but i do see that you paid the what can you tell me the amount what was the amount,neu
Ses05F_impro08_F017,okay i do see that on here and it says that um it had some trouble clearing for some reason and i think that was the problem on our end so um,neu
Ses05F_impro08_F018,well you know sometimes just with online transactions things happens so um,neu
Ses05F_impro08_M016,no no no i am grateful,neu
Ses05F_impro08_F019,yeah we somebody went in and and cleared the problem and it looks like youre all paid,neu
Ses05F_impro08_M018,did they take,neu
Ses05F_impro08_F020,you do the direct the direct it um its taking right out of your bank account correct,neu
Ses05F_impro08_M019,yes yes exactly,neu
Ses05F_impro08_F021,yeah so that that did go through,neu
Ses05F_impro08_M020,are you taking the late fee off of my account then,neu
Ses05F_impro08_F022,um i can try to do that for you certainly,neu
Ses05F_impro08_F023,right right and sinceyeah since it was just a computer glitch then thats that should be cleared up as well so im going to go ahead and try and put that into the computer and if for some reason you notice on your statement in a few days that youve been charged and an overdue fee then you should just call back and well have that,neu
Ses05F_impro08_M022,right,neu
Ses05F_impro08_F024,well ill give you my direct line and my number so you can you can get directly to me,neu
Ses05F_impro08_F025,yeah,neu
Ses05F_impro08_M025,that would be wonderful that would be great seriously,hap
Ses05F_impro08_F026,no problem,neu
Ses05F_impro08_M026,thank you whats the number,hap
Ses05F_impro08_F027,ahh one eight hundred three two three,neu
Ses05F_impro08_M027,three two three,neu
Ses05F_impro08_F028,six four nine four,neu
Ses05F_impro08_M028,six four nine four that would be so great thank you so much,hap
Ses05F_impro08_F029,youre welcome,neu
Ses05F_impro08_F030,im sorry that it was an inconvenience,neu
Ses05F_impro08_M030,it was horrible but youve made it much better thank you very much absolutely,hap
Ses05F_impro08_F032,have a good day,neu
Ses05F_impro08_M031,you too thank you so much have a wonderful day,hap
Ses05F_impro08_F033,bye bye,neu
Ses05M_impro01_F000,can i help you,neu
Ses05M_impro01_F001,oh this this form that you have is the wrong form you need to go over to the other line on the other side of the dmv,neu
Ses05M_impro01_F002,right but this is the wrong form somebody gave you the wrong form,neu
Ses05M_impro01_F003,yeah so i cant  i cant do anything,neu
Ses05M_impro01_F004,no but this is for um replacements and you need a new  whole new license as a california ,neu
Ses05M_impro01_M005,im not getting a  well you wait in this line and not get an attitude,ang
Ses05M_impro01_F006,no i understand and there are a lot of people here but what im telling you is that its different for different states and since your getting a new license in the state of california  you have to fill out a different form than you did,neu
Ses05M_impro01_F009,i know,neu
Ses05M_impro01_F012,yeah i know its gonna take a minute but you so you might as well get started now,neu
Ses05M_impro01_M015,wouldnt you oh come on you just tell me you would make an exception for me,ang
Ses05M_impro01_F021,im gonna im gonna bring security over and have them escort you out,ang
Ses05M_impro01_F023,well thats unfortunate sir youre gonna have to go stand in the other line now,ang
Ses05F_script02_1_M000,what time is it isnt it supposed to start running around midnight this is great isnt it look at this great night we got here couldnt be better,hap
Ses05F_script02_1_M001,actually i was hoping to go a little bit further up the coast to get away from the lights and the people but i was afraid i will miss it how are you doing,hap
Ses05F_script02_1_F000,fine,neu
Ses05F_script02_1_M002,is thatno no no is that foam i cant even tell although if i if i cant tell it probably isnt it right itll probably be unmistakable but dont you think how you doing,hap
Ses05F_script02_1_M003,oh no you know what i did i forgot my flashlight how could i be so stupid i cant believe i forgot my flashlight,hap
Ses05F_script02_1_F001,what flashlight,neu
Ses05F_script02_1_F005,yes,neu
Ses05F_script02_1_M009,are you cold you want my jacket we should have bought a blanket our blanket this is great isnt it,hap
Ses05F_script02_1_M010,i didnt even think to bring a sixpack a sixpack would be just the thing right about now i cant believe i forgot and look at kid i am surprise i make it out of the house about flies it,hap
Ses05F_script02_1_M011,laughter i wonder if they can hear me talk or if they can feel the vibration in the sand when we are moving around,hap
Ses05F_script02_1_M012,you want my jacket,hap
Ses05F_script02_1_F007,its after eleven lets go home,neu
Ses05F_script02_1_M014,right,hap
Ses05F_script02_1_F011,not particularly,neu
Ses05F_script02_1_F012,i just dont,neu
Ses05F_script02_1_M018,honey this is a natural phenomenon i mean it happens like once a year its a great opportunity,hap
Ses05F_script02_1_M019,think about people in kansas they have to get a a plane reservation and a hotel reservation just to see this uh but we are just forty minutes away too good to pass up,hap
Ses05F_script02_1_M020,yeah but that moment on the beach is the highlight of their little lives all that flopping around is laying eggs or what you mating or spawning or something like that,hap
Ses05F_script02_1_M021,this is a big night for these guys lifes last orgy yeah,hap
Ses05F_script02_1_M023,okay but they are fish that do something that no other fish do like the swallows returning to capistrano or the lemmings jumping off a cliff you know like that,hap
Ses05F_script02_1_M024,theres theres mystery here and magic a little bit of the unexplainable i cant understand how you could not be interested,hap
Ses05F_script02_1_F015,i am just not,neu
Ses05F_script02_1_F016,yes,neu
Ses05F_script02_1_M029,look there whats that is it is that aah its a seaweed isnt it,hap
Ses05F_script02_1_M030,oh this is great i wouldnt miss this for the world i mean think about this i know you are not interested but think about this for a second,hap
Ses05F_script02_1_M031,somewhere out there is a giant mass of silver fish all swimming in this direction they dont know why and we dont know why they didnt get an invitation and it wasnt a vote it wasnt a decision and nobody sent them a map or anything like that,hap
Ses05F_script02_1_M032,its just some little instinctual timerelease firecracker that went off inside them and all this one they turn around and form a line as long as the california coast and just started swimming,hap
Ses05F_script02_1_M033,they are swimming right now as if its the only thing that matters its its single mindedness with no mind urgency thats pure urge its they dont know what drives them they they dont give any name or ask any question they just turn as one and started to swim to the very point we are standing right now for a massive celebration of sex and death god its giving me goose bumps all over my hairs on my arm popping up,hap
Ses05F_script02_1_M034,well so what do you think,hap
Ses05F_script02_2_M000,well so what do you think,hap
Ses05F_script02_2_M002,it certainly is not its slightly exaggerated scientific fact,neu
Ses05F_script02_2_M003,i am not the only one look at all these people,neu
Ses05F_script02_2_M005,carla can i ask you a question now dont be upset are you having a period,neu
Ses05F_script02_2_F005,god damn it augie why do you always ask things like that its so insulting,ang
Ses05F_script02_2_M010,well we will see them this year,neu
Ses05F_script02_2_F013,augie do you remember the first time we came to see it it was about four years ago right after we got married and we thought i was pregnant,sad
Ses05F_script02_2_F014,we had a bottle of champagne but no glasses and you ask me to dance so we took off our shoes and while we were dancing you said the most intimate things right in my ears so i could feel them as much as hear them,sad
Ses05F_script02_2_F015,and i remember thinking finally finally i am as happy as i am supposed to be,hap
Ses05F_script02_2_M016,wait a minute i got it,neu
Ses05F_script02_2_F016,dancing barefoot in the sand drinking champagne from the bottle,sad
Ses05F_script02_2_F017,i rather not remember some things i rather not hope for some things,sad
Ses05F_script02_2_M018,okay all right i got it you wanted it to be like the other time okay no problem listen you want to dance,hap
Ses05F_script02_2_F018,no,sad
Ses05F_script02_2_M019,you want me to go get some champagne,hap
Ses05F_script02_2_F019,no,sad
Ses05F_script02_2_M020,take off our shoes,hap
Ses05F_script02_2_M025,what welcome to the human race,ang
Ses05F_script02_2_F025,this what what is this this isnt even anything,sad
Ses05F_script02_2_F026,sure this is standing this is waiting this is fighting,sad
Ses05F_script02_2_F027,but this isnt anything like i thought it would be,sad
Ses05F_script02_2_M031,no i know me either,sad
Ses05F_script02_2_F028,i mean it is just this  i mean it includes a lot and everything and you know its the sand and its the full moon and i justi am sorry but i couldnt help wishing i was somewhere else,sad
Ses05F_script02_2_M032,maybe if you are with somebody else too,sad
Ses05F_script02_2_F029,i didnt say that,sad
Ses05F_script02_2_M033,no i know but i know i dont make you happy,sad
Ses05F_script02_2_F030,for heavens sake augie wherever i am i always wanted to be with you,sad
Ses05F_script02_2_F032,whatever i am doing i wanted to be with you i mean you are probably the one who wishes you were with somebody else somebody who didnt take everything so hard and who knows how to enjoy herself,sad
Ses05F_script02_2_M035,actually now that you mention it no i dont,hap
Ses05F_script02_2_F033,good so maybe we are on the wrong spot but we are with the right person,hap
Ses05F_script02_2_M036,i dont know seems like a pretty good spot to me i mean look at the view of the moon you got from here,hap
Ses05F_script02_2_F034,yes i did notice that it does look really beautiful on the water the gold white moon,hap
Ses05F_script02_2_M037,well look what we have got here,hap
Ses05F_script02_2_F037,no i am beginning to think that maybe this is the spot after all,hap
Ses05F_script02_2_M040,shh if were very quiet the fish might come,hap
Ses05F_script02_2_M041,or not,hap
Ses05F_script03_1_M000,good god,hap
Ses05F_script03_1_M001,i wonder,hap
Ses05F_script03_1_M005,hello hello what wrong number,hap
Ses05F_script03_1_F005,oh it sent shivers up my spine,hap
Ses05F_script03_1_F006,behave exquisitely,hap
Ses05F_script03_1_M007,with the most perfect poise,hap
Ses05F_script03_1_F007,yes i shall probably do a court curtsey,hap
Ses05F_script03_1_F010,the whole business is really rather ridiculous,neu
Ses05F_script03_1_F011,meaning exactly that,neu
Ses05F_script03_1_M011,what does it all mean thats what i asked myself in my ceaseless quest for ultimate truth dear god what does it all mean,hap
Ses05F_script03_1_F013,whos they,neu
Ses05F_script03_1_M013,all the futile mortals who try to make life unbearable laugh at them be flippant laugh at everything all their sacred shibboleths flippancy brings out the acid in their damned sweetness and light,hap
Ses05F_script03_1_M014,certainly you must were figures of fun alright laughter,hap
Ses05F_script03_1_F015,well what ifwhat happens when our love,neu
Ses05F_script03_1_M015,who knows,hap
Ses05F_script03_1_M016,no that fire will fade along with our passion,hap
Ses05F_script03_1_M017,it all depends on how well we played,hap
Ses05F_script03_1_F019,well what if one of us dies does the other laugh then,neu
Ses05F_script03_1_M018,yes yes with all his might,hap
Ses05F_script03_1_M019,no no it isnt death is very laughable come such a cunning little mystery all done with mirrors,hap
Ses05F_script03_1_M020,no so is everyone else in the long run lets be superficial and pity the poor philosophers lets blow trumpets and squeakers and ,hap
Ses05F_script03_1_M021,enjoy the party as long as we can like very little quite idiotic schoolchildren garbage lets savor the delight of the moment,hap
Ses05F_script03_1_M022,darling come here and kiss me before your body rots and worms pop in and out of your eye sockets,hap
Ses05F_script03_1_M024,do you remember that awful scene we had in venice,hap
Ses05F_script03_1_M025,the one where you bought that little painted wooden snake and put it on my bed,hap
Ses05F_script03_1_F025,charles that was his name he did wriggle so beautifully,hap
Ses05F_script03_1_M026,horrible thing i hate it,hap
Ses05F_script03_1_M027,how long did that row last,hap
Ses05F_script03_1_M028,the worst one was in cannes when your curling irons burnt a hole in my new dressing gown,hap
Ses05F_script03_1_M029,oh that was quite a rouser wasnt it,hap
Ses05F_script03_1_M030,oh i didnt hit you very hard,neu
Ses05F_script03_1_F030,and then the manager came in and found us rolling around on the floor biting and scratching like panthers,hap
Ses05F_script03_1_M031,laughter i shall never forget his face,hap
Ses05F_script03_1_F031,oh ridiculous utterly ridiculous,hap
Ses05F_script03_1_M032,oh we were very much younger then,hap
Ses05F_script03_1_M033,oh as a matter of fact the real cause of that row was peter burden,hap
Ses05F_script03_1_F033,you knew there was nothing,neu
Ses05M_impro05_M000,hi um my luggage didnt come out of the conveyor thingy,neu
Ses05M_impro05_F000,hmm hmm,neu
Ses05M_impro05_M001,so um what do i do,neu
Ses05M_impro05_F001,how long ago was that,neu
Ses05M_impro05_M002,uh like an hour and a half ago i talked to somebody who was standing out there and they said wait sometimes like random butt pieces come out late,neu
Ses05M_impro05_F002,uhhmm,neu
Ses05M_impro05_M003,and so i waited there but nothing came,neu
Ses05M_impro05_F003,um okay well you can fly file a claim where were you coming from,neu
Ses05M_impro05_M004,i was coming from um the midwest like iowa,neu
Ses05M_impro05_F004,so within the country though umm,neu
Ses05M_impro05_M005,yeah i know i was in the country i mean its not that complicated,neu
Ses05M_impro05_F005,yeah well the chances of it being lost forever you know are slight because   you were in the ,neu
Ses05M_impro05_M006,well i would hope so,neu
Ses05M_impro05_F006,well i mean you know that happens pretty often that sometimes baggage   gets lost,neu
Ses05M_impro05_M007,people lose ,neu
Ses05M_impro05_F007,yeah,neu
Ses05M_impro05_M009,you know this is actually i mean its  its a really important piece of luggage,neu
Ses05M_impro05_F008,okay,neu
Ses05M_impro05_M010,i mean its not big or anything like that i mean its not worth a lot of money or anything,neu
Ses05M_impro05_F009,did you have insurance on your flight,neu
Ses05M_impro05_F010,no you have to buy it now its like thirty dollar extra,neu
Ses05M_impro05_F011,well its something that worth,neu
Ses05M_impro05_F012,yeah i dont know,neu
Ses05M_impro05_F013,chances are its probably just you know  taking time being um unloaded from the airplane,neu
Ses05M_impro05_F014,um well theres not much i can do i can you can file this report and well call you when it comes in,neu
Ses05M_impro05_F015,wow,neu
Ses05M_impro05_F016,wow well thats really important obviously but um ,neu
Ses05M_impro05_F017,uh actually i dont know that thats legal um it is the issue,neu
Ses05M_impro05_F018,yeah i mean your bag might have been confiscated because its ,neu
Ses05M_impro05_F019, its a biohazard so um,neu
Ses05M_impro05_F020,yeah let me just call security,neu
Ses05M_impro05_F021,laughter okay hold on,neu
Ses05M_impro05_M022,thank you,neu
Ses05M_impro02_M000,sweetheart ive got to tell you something i just got a call im going to iraq,sad
