Utterance_ID,Text,Emotion
Ses02F_script01_2_M001,well maybe he just wanted to see her again,neu
Ses02F_script01_2_M002,what do you mean he lived next door to the girl all his life why wouldnt he want to see her again,neu
Ses02F_script01_2_M004,how do you know hes even thinking of it,neu
Ses02F_script01_2_F005,its got that all about it,ang
Ses02F_script01_2_M005,well so what,neu
Ses02F_script01_2_M006,now listen kate,neu
Ses02F_script01_2_M007,you cant read her mind,neu
Ses02F_script01_2_M008,how do you know why shes waited,neu
Ses02F_script01_2_F012,because if hes not coming back ill kill myself i mean laughlaugh at me but,ang
Ses02F_script01_2_F013,but why did that happen the very night she came here she sleeps in his room and his memorial breaks to pieces just look look at it,ang
Ses02F_script01_2_M016,what does that mean me above all,ang
Ses02F_script01_2_M017,look at you look at you shaking,ang
Ses02F_script01_2_M018,what have i got to hide what the hell is the matter with you kate,ang
Ses02F_impro04_M000,so uh so hows it been going i mean you have any needs or anything,neu
Ses02F_impro04_M001,no you cant think that way i mean its goodits good that yourethat youre calling you know you cant,neu
Ses02F_impro04_M003,no come on dont garbage,neu
Ses02F_impro04_M004,i know i know its hard but you justyou gotta keep going i mean youve been going at it for so long you know something is definitely going to come up ii know it will because youre a good worker,neu
Ses02F_impro04_M005,no itsi mean its competitive you know thatsthats what it is thats what you gotta be is competitive,neu
Ses02F_impro04_M006,therethere are plenty of people out there withwith like good jobs you know that are a lot,neu
Ses02F_impro04_M007,dumber than you i mean theyre a lot worse off than you you are much better off than like a lot of those people in there i know,neu
Ses02F_impro04_M008,i know it makes it harder i mean its definitely who you know in a lot of cases but,neu
Ses02F_impro04_M009,but you gotta otherwise what iswhats your other option,neu
Ses02F_impro04_F009,i feel so worthless,sad
Ses02F_impro04_M010,its not worthless cause its definitely gonnaits definitely gonna pay off i know it i mean i canive justive seen your work etiquette you know youre a good worker and,neu
Ses02F_impro04_M011, and theres no reason thatthat something wont come up like really soon all right so you just gotta,neu
Ses02F_impro04_M012,because i know you you know and maybe once you get to know some more people like talking to them and everything theyll get to know you too and theyll realize they shouldve hired you three years ago you know but and and theyll finally come around and believe meitllyou gotta,neu
Ses02F_impro04_M013,well maybe yeah but maybe you get to that point where its like you bug em and then they just dont wanna hear from you anymore but you keep bugging them and bugging them and then its gonna annoy them so much that theyre gonna be like all right fine you know,neu
Ses02F_impro04_M015,that obviously thats not true though i mean youve done this before youve done all the work like this before you know and and youve gotten people saying oh youre so good and like you know,neu
Ses02F_impro04_M016,right,neu
Ses02F_impro04_M017,well youve gotta live,neu
Ses02F_impro04_M018,i mean its just its reallyi dont know yeah its about their opinions and its about i dont know just getting yourself out there and,neu
Ses02F_impro04_F016,i just wanna crawl in a hole you know like it just makes you not wanna even open your eyes in the morning,sad
Ses02F_impro04_M019,well come on come on thinking about it like this is definitely not gonna help either though,neu
Ses02F_impro02_F000,its almost time for me to go,sad
Ses02F_impro02_F001,theres nothing i can do i mean the government you know,sad
Ses02F_impro02_F002,youre gonna have to i mean youre a great father you can do it i know you can,sad
Ses02F_impro02_F003,i dont think so,sad
Ses02F_impro02_F004,well we can do the best we can andand with um you know like wireless internet these daysi think that we could talk every once in awhile,sad
Ses02F_impro02_F005,you could send me pictures,sad
Ses02F_impro02_F006,their not gonna let you you have to stay home and i have to go i mean thats all,sad
Ses02F_impro02_F007,andi mean my daughteri dont want to put her in danger you know she has to stay,sad
Ses02F_impro02_F008,i know but she needs to be safe more she needs to be around kids her ageown age she needs to be able to play on the streets and,sad
Ses02F_impro02_M007,but shesyoure not gonnayoure not gonna be here forfor her first words for her first steps i meanits something that youre supposed to be here for that,sad
Ses02F_impro02_F009,you can just remember it for me,sad
Ses02F_impro02_F010,well i needi need you to be able to do this for me cause i cant do anything about it,sad
Ses02F_impro02_F011,i mean its just as hard for me buti know that we can do it you know,sad
Ses02F_impro02_F012,i dont want you in danger and i dont want her in danger,sad
Ses02F_impro02_F013,i have no choice theres nothing i can do,sad
Ses02F_impro02_M012,all right,sad
Ses02F_script03_1_M001,i wonder,neu
Ses02F_script03_1_M004,i dont care then,neu
Ses02F_script03_1_M005,hello hello what wrong number,neu
Ses02F_script03_1_F005,ah it send shivers up my spine,hap
Ses02F_script03_1_F006,behave exquisitely,hap
Ses02F_script03_1_M007,with the most perfect poise,neu
Ses02F_script03_1_F007,oh of course i shall probably do a court curtsy,hap
Ses02F_script03_1_M008,things that ought to matter dreadfully dont matter at all when ones happy do they,neu
Ses02F_script03_1_F008,whats so horrible is that one cant stay happy,hap
Ses02F_script03_1_M009,oh darling dont say that,neu
Ses02F_script03_1_F009,its true the whole business is a very poor joke,hap
Ses02F_script03_1_M010,meaning that sacred and beautiful thing love,neu
Ses02F_script03_1_F010,yes meaning just that,hap
Ses02F_script03_1_M012,you mustnt be serious my dear one thats just what they want,neu
Ses02F_script03_1_F012,whos they,neu
Ses02F_script03_1_M013,all those futile moralists that try to make life unbearable laugh at them be flippant laugh at everything all their sacred shibboleths,neu
Ses02F_script03_1_M014,flippancy brings out the acid in their damn sweetness and light,neu
Ses02F_script03_1_F013,if i laugh at everything then i must laugh at us too,neu
Ses02F_script03_1_M015,certainly you must were figures of fun alright,neu
Ses02F_script03_1_F014,well how long will it last us this ludicrous overbearing love of ours,neu
Ses02F_script03_1_M016,who knows,neu
Ses02F_script03_1_F015,well shall we always want to bicker and fight,neu
Ses02F_script03_1_M017,no that desire will fade along with our passion,neu
Ses02F_script03_1_F016,oh dear shall we like that,neu
Ses02F_script03_1_M018,depends on how well weve played,neu
Ses02F_script03_1_F017,well what happens if one of us dies i mean does the one thats left still laugh,neu
Ses02F_script03_1_M019,yes yes with all his might,hap
Ses02F_script03_1_M020,no no it isnt death is very laughable such a cunning little mystery all done with mirrors,hap
Ses02F_script03_1_F019,darling i believe youre talking nonsense,hap
Ses02F_script03_1_M021,so is everyone else in the long run,neu
Ses02F_script03_1_M022,lets be superficial and pity the poor philosophers lets blow our trumpets and squeakers and enjoy the party as much as we can like quite idiotic very small school children lets savor the delight of the moment,hap
Ses02F_script03_1_M023,come and kiss me darling before your body rots and worms pop in and out of your eye sockets,hap
Ses02F_script03_1_F020,elliott worms dont pop,hap
Ses02F_script03_1_M024,i dont care what you do see you could paint yourself green and dance naked in the place vendome and rush off madly with all the men in the world and i shant say a word as long as you love me best,neu
Ses02F_script03_1_F021,oh thank you dear the same applies to you except that if i catch so much as looking at another woman ill kill you,hap
Ses02F_script03_1_M025,you remember that awful scene we had in venice,neu
Ses02F_script03_1_F022,which particular one,hap
Ses02F_script03_1_M026,the one when you bought that little painted wooden snake in the piazza and put it on my bed,neu
Ses02F_script03_1_F023,charles that was his name charles he did wriggle so beautifully,hap
Ses02F_script03_1_F024,yes i know you did you threw it out of the window into the grand canal i dont think ill ever forgive you for that,hap
Ses02F_script03_1_M028,how long did that row last,neu
Ses02F_script03_1_F025,it went in intermittently for days,hap
Ses02F_script03_1_M029,the worst one was in cannes when your curling iron burnt a hole in my new dressing gown,neu
Ses02F_script03_1_F026,it burned my comb too and all the towels in the bathroom,hap
Ses02F_script03_1_F027,that was the first time you ever hit me,neu
Ses02F_script03_1_M031,i didnt hit you very hard,neu
Ses02F_script03_1_F028,the manager came in and found us rolling around on the floor biting and scratching like panthers,hap
Ses02F_script03_1_M032,oh ill never forget his face,hap
Ses02F_script03_1_F029,it was ridiculous completely ridiculous,hap
Ses02F_script03_1_M033,we were very much younger then,neu
Ses02F_script03_1_M034,as a matter of fact the real cause of that row was peter burden,neu
Ses02M_script02_2_M000,so what do you think,neu
Ses02M_script02_2_M001,what i was saying,neu
Ses02M_script02_2_M002,certainly its not slightly exaggerated scientific fact,neu
Ses02M_script02_2_F005,goddamn it augie dont ask me that i hate it when you ask me that you always ask me that its insulting,ang
Ses02M_script02_2_F006,we just have different ideas of what this evening is supposed to look like,ang
Ses02M_script02_2_M010,well well see them this year,neu
Ses02M_script02_2_F011,i mean i feel like my whole life is going to be spent standing on the beach waiting for the fish to show up with my eyes open and my hands clasped expectantly and the fish wont show up,ang
Ses02M_script02_2_F013,i did want to see them i always do i mean i keep thinking that this is going to be the time and it never is,ang
Ses02M_script02_2_M015,you were fine during the phone call from marge dinner was okay doing the dishes was no problem lets see i took a shower you watched the news you said,neu
Ses02M_script02_2_M016,the grunion are running tonight i said great lets go i feel lucky,neu
Ses02M_script02_2_M017,okay so im getting on my jacket and putting out the animals getting the car out of the garage,neu
Ses02M_script02_2_F015,do you remember the first time we came to see it it was about four years ago right after we got married,sad
Ses02M_script02_2_F016,we thought i was pregnant and we opened a bottle of champagne but no glasses you asked me to dance we kicked off our shoes and you popped the cork,sad
Ses02M_script02_2_F017,and when we were dancing you said the softest most intimate things to me right into my ears so i could feel them as much as hear them,sad
Ses02M_script02_2_F018,and i remember thinking that this is it you know at last at last i am as happy as i am supposed to be,sad
Ses02M_script02_2_F019,just dancing barefoot in the sand drinking champagne out of the bottle,sad
Ses02M_script02_2_M019,it was in the car right driving past the knickerbocker liquor locker you said lets get some champagne and i said times are wasting or something like that right,hap
Ses02M_script02_2_M020,of course i see it now you want this to be like that other time right thats it right,hap
Ses02M_script02_2_F020,id rather not remember some things i would rather not hope for some things,sad
Ses02M_script02_2_M021,yea okay sure no i see listen you want to dance,neu
Ses02M_script02_2_F021,no,sad
Ses02M_script02_2_M022,you want to go get some champagne,neu
Ses02M_script02_2_F022,no,sad
Ses02M_script02_2_M023,take off our shoes,neu
Ses02M_script02_2_M025,get married again,neu
Ses02M_script02_2_M029,well welcome to the human race all right do you think this is what i had in mind when i proposed you think i had this great fantasy going that four years down the road wed come to the beach and yell at each other over fish,ang
Ses02M_script02_2_F031,well but this isnt anything like i thought anything would be like,sad
Ses02M_script02_2_M035,no i know me neither,sad
Ses02M_script02_2_F034,i know that you meant this to be special and nice and theres the sand and the moon and everything but i just couldnt help thinking about being somewhere else,sad
Ses02M_script02_2_M037,maybe if you were with somebody else too,sad
Ses02M_script02_2_M038,no i know but still i know i dont make you happy,sad
Ses02M_script02_2_F037,dont be ridiculous i mean dont you know that,hap
Ses02M_script02_2_F038,youre the one who probably wishes he was with someone else someone who knew how to enjoy herself and didnt take everything so hard,sad
Ses02M_script02_2_M040,now that you mention it no i dont,hap
Ses02M_script02_2_M041,i dont know it seemed like a pretty good spot to me look at the moon  view the moon view i got from here,hap
Ses02M_script02_2_M042,what have we got here,hap
Ses02M_script02_2_F042,well i guess we dont need glasses,hap
Ses02M_script02_2_F044,augie im sorry,sad
Ses02M_script02_2_M045,shh if were very quiet the fish might come,hap
Ses02M_script02_2_F045,or not,hap
Ses02M_script02_2_M046,or not,hap
Ses02M_script02_2_F046,hmm,neu
Ses02M_script01_1_M003,i dont know when it cracked he ran into the house and cried in the kitchen,sad
Ses02M_script01_1_M004,no i figured it was best to leave him alone,sad
Ses02M_script01_1_M005,i could hear him right through the floor in my room,sad
Ses02M_script01_1_M012,weve got to say it to him,ang
Ses02M_script01_1_M013,for god sakes its been three years nobody comes back after three years thats insane,ang
Ses02M_script01_1_M016,you know why i brought annie here dont you,neu
Ses02M_script01_1_M017,you know,neu
Ses02M_script01_1_F015,i got an idea but whats the story,neu
Ses02M_script01_1_M018,im going to ask her to marry me,neu
Ses02M_script01_1_F018,well you want to make sure that your father isnt,neu
Ses02M_script01_1_M021,see it isnt just my business,ang
Ses02M_script01_1_F021,from fathers point of you he isnt dead and you have no right to take his girl,neu
Ses02M_script01_1_M024,i dont know why but every time i reach out for something that i really want i have to pull back cause someone else will suffer my whole bloody life time after time after time,ang
Ses02M_script01_1_F023,youre a considerate fellow theres nothing wrong with that,neu
Ses02M_script01_1_M025,to hell with that,ang
Ses02M_script01_1_M026,i wanted to get this settled first,neu
Ses02M_script01_1_F025,how do you know shell marry you maybe she feels the same way your father does,neu
Ses02M_script01_1_M027,well if she does then thats the end of it from her letters i think shes forgotten him,neu
Ses02M_script01_1_M028,i dont know ill find out then well trash it out with dad right mom dont avoid me,sad
Ses02M_script01_1_F026,trouble is you dont see enough women you never did,ang
Ses02M_script01_1_F027,i just dont see why it has to be annie,ang
Ses02M_script01_1_M035,if i cant do that here well then ill have to get out,sad
Ses02M_script01_1_F032,what the hell is this,ang
Ses02M_script01_1_M036,ill get out ill get married and go live some place else maybe new york,sad
Ses02M_script01_1_F033,what the hell is this are you crazy,ang
Ses02M_script01_1_M037,ive been a good son too long a good sucker im through with it,ang
Ses02M_script01_1_F034,what about the business what is this,ang
Ses02M_script01_1_M038,the business the business doesnt inspire me,ang
Ses02M_script01_1_F035,must you be inspired,ang
Ses02M_script01_1_M039,yes i like it and hour a day if im going to grub for money all day long at least in the evening i want it beautiful,ang
Ses02M_script01_1_F036,tell me youd leave the business,ang
Ses02M_script01_1_M041,yes on this i would,sad
Ses02M_script01_1_F037,well you dont want to think like that,ang
Ses02M_script01_1_F041,yea i can see that,sad
Ses02M_impro08_M000,all right customer service this is steve,neu
Ses02M_impro08_F000,hi thank you so much youre a real person right youre not like a recording,hap
Ses02M_impro08_F001,okay before i get into it um your menu or whatever like where you choose the different thing depending on the,hap
Ses02M_impro08_F002,it leads you around in circles you cant there is no way to like get to a real person if you dont already know how to get to there,hap
Ses02M_impro08_M002,right no yes i know it isit is a little frustrating,neu
Ses02M_impro08_M003,i ill give you a little hint next time if it asks if youre on a rotary phone you know just stay on the line instead of  instead of hitting one or two to say if youre like on a touch tone,neu
Ses02M_impro08_M004,pretend like your on a rotary phone goes straight through to a person,neu
Ses02M_impro08_M005,i know they dont tell you that kind of thing,neu
Ses02M_impro08_F006,sorry okay um yes,neu
Ses02M_impro08_F007,thank you very much um so i have a charge on my credit card that um isnt mine,neu
Ses02M_impro08_F008,uh i dont know where it came from and its actually quite large and i dont have the money for it so,neu
Ses02M_impro08_M007,yea all right well let melet me look it up here for a second uh so i think,neu
Ses02M_impro08_F010,okay it was um at the garbage sorry it was at a department store i think it was macys or something,neu
Ses02M_impro08_M008,okay alright yeah i i see it on here,neu
Ses02M_impro08_M009,all right well you know thats thats what we have all of our protection plans for and everything like that so i mean its,neu
Ses02M_impro08_M010,it itll work out fine,neu
Ses02M_impro08_M011,yes well get well get rid of it right now i mean just were going to have to have you um submit something you know were going to have to have you mail something in for us okay,neu
Ses02M_impro08_M012,so so you can um find that application you have the internet you can go to our website,neu
Ses02M_impro08_M013,yeah yeah you get the form right now and yeah,neu
Ses02M_impro08_M014,we could mail it to you as well but,neu
Ses02M_impro08_M015,right you can go online print it out and just fill out the form and um send it to us um you know regarding the grievance and,neu
Ses02M_impro08_M016,and itll get taken off um no problem you know,neu
Ses02M_impro08_M017,right i mean we might,neu
Ses02M_impro08_M018,okay,neu
Ses02M_impro08_M019,uh i mean have you been shopping around on the internet and stuff i mean that you gave,neu
Ses02M_impro08_F019,i did buy one thing on ebay i dont know that might,neu
Ses02M_impro08_M020,uhha i mean usually sites are pretty well protected but sometimes i mean information gets out so,neu
Ses02M_impro08_M021,so it is a little a little hard in that situation if you want  you know you can um we can we can issue another credit card,neu
Ses02M_impro08_M022,yeah yeah maybe well uh,neu
Ses02M_impro08_M023,its a different number and everything,neu
Ses02M_impro08_M024,yeah yeah,neu
Ses02M_impro08_M025,yes um but for for that for that charge we will need you to send something in but we can get you processed immediately for this for this for this new card it still goes to the same address right,neu
Ses02M_impro08_M026,okay all right then well get it sent out there and,neu
Ses02M_impro08_F023,great,hap
Ses02M_impro08_M027,and you know just i mean be careful in the future if um,neu
Ses02M_impro08_F024,yeah,hap
Ses02M_impro08_M028,if youre ever online or anything like that i mean just make sure its a secure site and,neu
Ses02M_impro08_M029,and never you know give it to anyone out never even give out your number to any like unreliable company that you havent heard of or anything like that all right because um we want to we definitely want to help you out but,neu
Ses02M_impro08_F025,right right,neu
Ses02M_impro08_F026,okay great,neu
Ses02M_impro08_F027,yeah totally,neu
Ses02M_impro08_M030,you know it gets it gets difficult you know so alright,neu
Ses02M_impro08_F028,well thank you so much youve been very helpful i really appreciate it,hap
Ses02M_impro08_M031,alright yes im sorry for all the inconvenience but well get it taken care of,neu
Ses02M_impro08_F030,thank you very much bye,hap
Ses02M_impro01_F000,hi how can i help you,neu
Ses02M_impro01_M001,yea i just want to get this done,neu
Ses02M_impro01_F001,sure um,neu
Ses02M_impro01_M002,get my new license,neu
Ses02M_impro01_F002,do you have two forms of id with you,neu
Ses02M_impro01_M003,um no i got my drivers license though,neu
Ses02M_impro01_F003,i actually need two forms of id i need either a passport or a birth certificate or social security card im sorry,neu
Ses02M_impro01_M004,uh sorry i forgot them i mean ive got to ,neu
Ses02M_impro01_F004,well,neu
Ses02M_impro01_M005,well is the dridrivers license going to work,neu
Ses02M_impro01_F005,i i can take your drivers license but i need another form of id in order to process this paper work,neu
Ses02M_impro01_F006,um that you would need to go home and get another form of id and come back,neu
Ses02M_impro01_M007,what i you telling me i waited in that huge line to go and sit down and get my number called like after,ang
Ses02M_impro01_M008,three hours and,ang
Ses02M_impro01_M009,shouldnt they have like told us about that i mean why  why would they make me go and wait three hours if i have got to go and do it again,ang
Ses02M_impro01_M010,its standard i mean i dont work at the dmv how am i supposed to know that like i stand in line i get my,ang
Ses02M_impro01_M011,i filled out the application right didnt i,ang
Ses02M_impro01_F015,im sorry sir,neu
Ses02M_impro01_F016,there is nothing i can do,neu
Ses02M_impro01_M018,you shouldnt you have like a sign or something maybe like up on the counter when you get the applica maybe on the application,ang
Ses02M_impro01_M019,what web i didnt go to a website  why would i need to  its the dmv you come to the dmv you wait in line for three hours and then you go home,ang
Ses02F_script01_1_F004,did you talk to him,sad
Ses02F_script01_1_F005,he cried hard,sad
Ses02F_script01_1_F006,what was he doing out here at that hour,sad
Ses02F_script01_1_M011,why shouldnt he dream of him and walk the nights waiting for him do we contradict him do we say straight out that we dont have any hope anymore that we havent had hope for years now,ang
Ses02F_script01_1_M013,for god sakes its been three years nobody comes back after three years its insane,ang
Ses02F_script01_1_F017,ive got an idea but whats the story,sad
Ses02F_script01_1_M017,im gonna ask her to marry me,neu
Ses02F_script01_1_F018,well thats only your business chris,neu
Ses02F_script01_1_F019,what do you want me to do youre old enough to know your own mind,ang
Ses02F_script01_1_M021,well then it isnt just my business,ang
Ses02F_script01_1_F021,im just saying that,neu
Ses02F_script01_1_M023,shes not larrys girl,ang
Ses02F_script01_1_F025,youre a considerate fellow theres nothing wrong with that,neu
Ses02F_script01_1_M025,to hell with that,ang
Ses02F_script01_1_F026,breathing have you asked annie yet,neu
Ses02F_script01_1_F027,well how do you know shell marry you maybe she feels the same way your father does,neu
Ses02F_script01_1_M027,well if she does then thats the end of it but from her letters i think shes forgotten him ill find out and then well thrash it out with dad right mom dont avoid me,sad
Ses02F_script01_1_F028,trouble is you dont see enough women,sad
Ses02F_script01_1_M029,because it is,neu
Ses02F_script01_1_F036,are you crazy,ang
Ses02F_script01_1_M036,ive been a good son too long a good sucker im through with it,ang
Ses02F_script01_1_F037,what about the business what the hell is this,ang
Ses02F_script01_1_M037,the business the business doesnt inspire me,ang
Ses02F_script01_1_F038,must you be inspired,ang
Ses02F_script01_1_M038,yes i like it an hour a day if im gonna grub for my money all day long at least in the evening i want it beautiful,ang
Ses02F_script01_1_M040,yes on this i would,neu
Ses02F_script01_1_F040,well you dont want to think like that,ang
Ses02F_script01_1_M043,i am thinkin that way,neu
Ses02F_script01_1_M044,no you dont im a pretty tough guy,neu
Ses02F_script01_1_F044,i can see that,sad
Ses02M_script01_2_F000,why did he invite her here,ang
Ses02M_script01_2_F001,shes been in new york three and half years why all of a sudden,ang
Ses02M_script01_2_M001,well maybe he just wanted to see her again,neu
Ses02M_script01_2_F002,nobody comes seven hundred miles just to see,ang
Ses02M_script01_2_F003,hes not going to marry her,ang
Ses02M_script01_2_M004,how do you know hes even thinking of it,neu
Ses02M_script01_2_M005,well so what,neu
Ses02M_script01_2_F005,whats going on here joe,ang
Ses02M_script01_2_F006,shes not his girl joe she knows shes not,ang
Ses02M_script01_2_M007,you cant read her mind,neu
Ses02M_script01_2_F010,i want you to act like hes coming back both of you dont you think i havent noticed since he invited her i wont stand for any nonsense,ang
Ses02M_script01_2_F013,i need you to believe with me i cant stand all alone,sad
Ses02M_script01_2_M016,what does that mean me above all,ang
Ses02M_script01_2_M017,look at you  look at you shaking,ang
Ses02M_impro02_F000,i dont want you to go,sad
Ses02M_impro02_M000,i know i know i dont want to go either baby i love you know and im going to miss you a lot,sad
Ses02M_impro02_F001,im going to miss you too i dont know what im going to do here without you its going to be so lonely and so hard,sad
Ses02M_impro02_F002,i dont want to be a single mom,sad
Ses02M_impro02_M001,you wont be ill be back ill be back before you know it all right and,sad
Ses02M_impro02_F003,but,sad
Ses02M_impro02_M002,and,sad
