Utterance_ID,Text,Emotion
Ses05M_impro02_M001,i know its really crappy timing but i dont have a choice,sad
Ses05M_impro02_M007,i dont have a choice i have to go if i dont go theyll come and take me,sad
Ses05M_impro02_M010,i know,sad
Ses05M_impro02_M011,i dont want to  the kids youve got to take care of them youve got youve got to,sad
Ses05M_impro02_M012,tell them about me and show them pictures of me and everything like that because they are not going to see me for such a long time and its such an important time and i just dont want to miss it,sad
Ses05M_impro02_M013,i dont have  i know what are we gonna what are we just run away what can i do where can we go,sad
Ses05M_impro02_F012,what would be the worst that would happen if they found you somewhere else,neu
Ses05M_impro02_F013,well theyre so young,sad
Ses05M_impro02_M018,i know but illill send the pictures all the time and ill write them emails and you can read them the emails that i send them,sad
Ses05M_impro02_M019,im gonna be in bagdad just doing security,sad
Ses05M_impro02_M021,i just want to be honest with you i dont want you to ,sad
Ses05M_impro02_M022,but its gonna be fine im gonna be fine you know im good at this i can do this thats why i trained all this time im good at this okay,sad
Ses05M_impro02_M023,i know i know i know but you know what that doesnt mean its gonna be me does it,sad
Ses05M_impro02_M024,no it doesnt and you cant think like that,sad
Ses05M_impro02_M025,i dont want you to  i know i know you cant worry about me youve got to worry about the kids and youve got to take care of the kids for me okay take care of the kids for me all right,sad
Ses05M_impro02_F020,its just so much,sad
Ses05M_impro02_M027,ill miss you baby,sad
Ses05M_impro02_F021,garbage you have to write me everyday,sad
Ses05M_impro02_M028,all ill write you everyday all the time and ill send you pictures and you send me pictures i know weve got email out there weve got email and i can see stuff and you can send me stuff all the time okay,sad
Ses05M_impro02_M029,yeah yeah yeah,sad
Ses05M_impro02_M030,you you record every second you record every second because i want to see it all okay,hap
Ses05M_impro02_F023,okay,sad
Ses05M_impro02_F024,garbage,sad
Ses05M_script01_1_F000,whats he going to say maybe we should tell him before he sees it,sad
Ses05M_script01_1_F001,when i was the first one up he was still in bed how could he have seen it,sad
Ses05M_script01_1_F004,did you talk to him,sad
Ses05M_script01_1_M004,no i figured it was best to leave him alone,sad
Ses05M_script01_1_F005,he cried hard,sad
Ses05M_script01_1_M011,why should he dream about him walking around looking for him at night do we contradict him do we say straight out that we dont have any hope anymore that we havent had any hope for years now,ang
Ses05M_script01_1_M013,for gods sake three years nobody comes back after three years thats insane,ang
Ses05M_script01_1_F014,the trouble is the god damn newspapers i mean every every week a kid turns up missing like longer than larry,ang
Ses05M_script01_1_M016,you know,neu
Ses05M_script01_1_M017,im going to ask her to marry me,neu
Ses05M_script01_1_F018,well what do you want me to do youre old enough to make to know your own mind,ang
Ses05M_script01_1_M020,oh so it isnt just my business,ang
Ses05M_script01_1_M021,you infuriate me sometimes do you know that god,ang
Ses05M_script01_1_M022,isnt it your business too if dad  if i tell dad and he throws a fit about it i mean you have such a talent for ignoring things,ang
Ses05M_script01_1_F021,i ignore what i got to ignore i mean the girl is larrys girl,ang
Ses05M_script01_1_M023,she is not larrys girl,ang
Ses05M_script01_1_F022,from your fathers point of view hes not dead and shes still his girl now you can go on from there if you know where to go chris but i dont know so what can i do for you,ang
Ses05M_script01_1_F023,well youre a considerate fella theres nothing wrong in that,neu
Ses05M_script01_1_M025,to hell with that,ang
Ses05M_script01_1_F024,have you asked annie yet,neu
Ses05M_script01_1_F025,well what if she feels like your father and how do you know she will marry you,neu
Ses05M_script01_1_F026,well the trouble is you never saw enough women,neu
Ses05M_script01_1_M028,so what im not fast with women,ang
Ses05M_script01_1_M032,ive given it three years of thought i hoped that if id waited dad would have forgotten about it by now and we could have like a normal wedding and everybody happy,ang
Ses05M_script01_1_M033,but if that cant happen ill just have to get out,ang
Ses05M_script01_1_M034,ill get out ill go get married and live someplace else i dont know maybe new york,ang
Ses05M_script01_1_F032,are you crazy,ang
Ses05M_script01_1_M035,i have been a good son for too long a good sucker im through with it,ang
Ses05M_script01_1_M036,yes on this i would,ang
Ses05M_script01_1_M037,well you help me stay here,ang
Ses05M_script01_1_F035,all right but dont think like that because what the hell did we work for chris i mean this whole thing its all for you,ang
Ses05M_script01_1_F036,just dont think that way do you hear me,ang
Ses05F_script01_2_M000,why does that bother you,neu
Ses05F_script01_2_F001,shes been in new york three and a half years why all of the sudden,neu
Ses05F_script01_2_M001,well maybe maybe she just wanted to see her again,neu
Ses05F_script01_2_M002,what did you mean he lived next door to the girl all of his life why wouldnt he want to see her again dont look at me like that he didnt tell me any more than he told you,neu
Ses05F_script01_2_F006,shes not his girl she knows shes not,ang
Ses05F_script01_2_F010,i want you to pretend like hes coming back,ang
Ses05F_script01_2_F011,because if hes not coming back then ill kill myself,ang
Ses05F_script01_2_F012,laugh laugh at me but what happens the night that she goes to sleep in his bed and his memorial breaks in pieces,ang
Ses05F_script01_2_F014,only last week another boy turned up in detroit been missing longer than larry you read it yourself,ang
Ses05F_script01_2_F016,youve got to believe youve got to,sad
Ses05F_script01_2_M016,what do you mean me above all look at you youre shaking,ang
Ses05F_script01_2_F017,i cant help it,ang
Ses05F_script01_2_M017,what have i got to hide what the hell is the matter with you kate,ang
Ses05F_script01_1_F000,whats he going to say maybe we should tell him before he sees it,sad
Ses05F_script01_1_M000,he saw it,sad
Ses05F_script01_1_M001,he was out here when it broke,sad
Ses05F_script01_1_M002,around four this morning and there was a crack and i looked out were standing right there when i cracked,sad
Ses05F_script01_1_M003,i dont know but when it cracked he ran back into the house and start to cry in the kitchen,sad
Ses05F_script01_1_F004,did you talk to him,sad
Ses05F_script01_1_M004,no i figured it was best to leave him alone,sad
Ses05F_script01_1_F005,he cried hard,sad
Ses05F_script01_1_M005,i could hear him right through the floor of my room,sad
Ses05F_script01_1_F006,he is thinking about him again,sad
Ses05F_script01_1_F007,its getting just like after larry died hes having dreams hes walking around at night,sad
Ses05F_script01_1_M006,i guess he is,sad
Ses05F_script01_1_F008,whats the meaning of that,sad
Ses05F_script01_1_M007,i dont know the meaning of it but i know one thing mom did we made a terrible mistake with dad,sad
Ses05F_script01_1_M008,being dishonest with him its the kind of thing that pays off and now its paying off,sad
Ses05F_script01_1_M009,you know that larrys not coming back and i know it so why do we go on letting him think that we believe with him,sad
Ses05F_script01_1_M013,for gods sake mom three years nobody comes back after three years its insane,ang
Ses05F_script01_1_M016,you know why i asked annie here dont you,sad
Ses05F_script01_1_F017,well i got an idea but whats the story,neu
Ses05F_script01_1_M018,im going to ask her to marry me,neu
Ses05F_script01_1_F024,well youre a considerate fellow theres nothing wrong with that,neu
Ses05F_script01_1_M025,to hell with that,ang
Ses05F_script01_1_F025,have you asked annie yet to marry you,neu
Ses05F_script01_1_F026,well how did you know that she will go along with it i mean maybe she feels the same way as your father,neu
Ses05F_script01_1_F027,the trouble is you dont see enough women you never have,neu
Ses05F_script01_1_F028,well i just dont see why it has to be annie,neu
Ses05F_script01_1_F031,you marry his girl and youre pronouncing him dead now whats going to happen to your father do you know i dont,sad
Ses05F_script01_1_F033,what the hell is this,ang
Ses05F_script01_1_F034,are you crazy,ang
Ses05F_script01_1_M035,the business the business it doesnt inspire me,ang
Ses05F_script01_1_F038,all right but dont think like that because i mean what the hell did we do all this for chris the whole business its all for you the whole shooting match is for you,ang
Ses05F_impro02_M000,what is it,neu
Ses05F_impro02_F001,um,sad
Ses05F_impro02_F002,im sorry its just a lot ahh to explain ahh i got a call,sad
Ses05F_impro02_F004,i got a call today,sad
Ses05F_impro02_F005,im going to need to go overseas for a while,sad
Ses05F_impro02_M004,you got called up,ang
Ses05F_impro02_M005,i thought you said this wasnt going to happen for at least a year,ang
Ses05F_impro02_F008,i dont know sigh,sad
Ses05F_impro02_F009,i know i know,sad
Ses05F_impro02_F010,i know well well have to figure all that out i mean i think the armys going to provide childcare and help us out with that um,sad
Ses05F_impro02_M010,where do you have to go where are you going,ang
Ses05F_impro02_F011,iraq,sad
Ses05F_impro02_F012,i think infantry im not sure,sad
Ses05F_impro02_M014,i dont understand why they would just do something like this,ang
Ses05F_impro02_M015,it doesnt make any sense its stupid i told you you shouldnt go in the army,ang
Ses05F_impro02_F021,i dont think theres anything we can do,sad
Ses05F_impro02_M024,ill tell them im sick and that you cant leave something,sad
Ses05F_impro02_M025,its not fair,sad
Ses05F_impro02_F023,i know i know its not fair,sad
Ses05F_impro02_M026,why has to be you theres all those other people somebody else can go instead its not right,sad
Ses05F_impro02_F024,well apparently nobody else can go,sad
Ses05F_impro02_M029,i understand im worried about you i dont know whats going to happen to you,sad
Ses05F_impro02_F027,i know,sad
Ses05F_impro02_F028,i know,sad
Ses05F_impro02_M031,i jus,sad
Ses05F_impro02_F029,well figure something out we just have to  we just have to think about this could any of your family help us,sad
Ses05F_impro02_M032,i dont know,sad
Ses05F_impro02_M033,yeah i guess i dont know what theyre going to say,sad
Ses05F_impro02_M034,yeah well call them well figure something out im sorry im sorry im sorry youre right,sad
Ses05F_impro02_F031,im going to miss their first words,sad
Ses05F_impro02_M035,i know,sad
Ses05F_impro02_F032,youll have to send me pictures and letters everyday,sad
Ses05F_impro02_M036,all the time every day every day they have email over there and stuff like that right i can send you pictures,sad
Ses05F_impro02_F034,yeah as much as i can,sad
Ses05F_impro02_F035,sigh three weeks,sad
Ses05F_impro02_F036,yeah,sad
Ses05F_impro02_F037,yeah,sad
Ses05F_impro02_M041,i love you,sad
Ses05F_impro02_F038,i love you im going to miss you so much sigh,sad
Ses05F_impro06_F000,a good friend of mine passed away the other day,sad
Ses05F_impro06_M001,oh no im so sorry what happened,sad
Ses05F_impro06_F001,oh they had some pretty progressive cancer,sad
Ses05F_impro06_F002,metastasized and it was old and they knew that it wasnt looking good but,sad
Ses05F_impro06_M002,thats the worst im so sorry did you know him well,sad
Ses05F_impro06_F003,yeah we were pretty close,sad
Ses05F_impro06_F004,breathing,sad
Ses05F_impro06_M003,i am so sorry its,sad
Ses05F_impro06_M004,its the worst when they go like that garbage was he young,sad
Ses05F_impro06_F005,kind of,sad
Ses05F_impro06_F006,its hard to watch when its painful for them you know,sad
Ses05F_impro06_M005,absolutely absolutely,sad
Ses05F_impro06_M006,its the think,sad
Ses05F_impro06_F007,i just i dont know,sad
Ses05F_impro06_M007,theres no reason for it,sad
Ses05F_impro06_F008,i know,sad
Ses05F_impro06_F009,and he could of he was pretty awesome,sad
Ses05F_impro06_M008,yeah whatd he do what did they do howd you know him,sad
Ses05F_impro06_F010,uh we grew up together,sad
Ses05F_impro06_M009,yeah,sad
Ses05F_impro06_M010,is he an actor too or,neu
Ses05F_impro06_F011,yeah he kind of did a lot of things but we acted together sometimes,sad
Ses05F_impro06_F012,i feel really bad for his family you know,sad
Ses05F_impro06_M011,yes of course of course,sad
Ses05F_impro06_F013,it must be really really hard to lose a child,sad
Ses05F_impro06_M012,was he very close to his family,neu
Ses05F_impro06_F014,yeah and they were really supportive like through the whole process but,sad
Ses05F_impro06_M013,yeah,neu
Ses05F_impro06_F015,breathing,sad
Ses05F_impro06_F016,i cant imagine what his what his parents are going through,sad
Ses05F_impro06_M014,of course not you have no idea what its like to lose a kid,sad
Ses05F_impro06_F017,yeah im just going to miss him,sad
Ses05F_impro06_F018,thank you,sad
Ses05F_impro06_M017,is there a funeral planned or,neu
Ses05F_impro06_F019,yeah theyre going to do some sort of memorial service or something,sad
Ses05F_impro06_M018,cool well if you want me to go with you i will,neu
Ses05F_impro06_F020,thanks,sad
Ses05F_impro06_M019,no problem,neu
Ses05F_impro06_F021,its really bizarre you know when you know somebody really well and then,sad
Ses05F_impro06_F022,something happens and they die and its like,sad
Ses05F_impro06_F023,really hard to imagine that like youre going to continue to live and that persons just going to have stopped,sad
Ses05F_impro06_M020,right it just doesnt make any sense its not real it doesnt feel real,sad
Ses05F_impro06_M021,yeah,neu
Ses05F_impro06_F024,breathing,sad
Ses05F_impro06_M022,do you know what its going to passeventually i mean itll never pass itll always be there and youll always remember and everything like that but you know itll get easier i guess,neu
Ses05F_impro06_F025,yeah,sad
Ses05F_impro06_M023,thats the best way to put it,neu
Ses05F_impro06_F026,its hard to say goodbye,sad
Ses05F_impro06_M024,absolutely,neu
Ses05F_impro06_F027,breathing,sad
Ses05F_impro06_M025,do you know what if it was me that died id really want you to be crying and being really upset too any way so i think you should definitely do this because its trying what its supposed to be,neu
Ses05F_impro06_F029,yeah yeah,sad
Ses05M_script01_2_M000,why does that bother you,neu
Ses05M_script01_2_M001,well maybe maybe he just wanted to see her again,neu
Ses05M_script01_2_F002,nobody comes seven hundred miles just to see,neu
Ses05M_script01_2_M003,why do you think hes even thinking that,neu
Ses05M_script01_2_F004,hes got that about it,neu
Ses05M_script01_2_F005,whats going on here joe,ang
Ses05M_script01_2_F015,you above all have got to believe,ang
Ses05M_script01_2_M015,whats that suppose to mean me above all look at you youre shaking,ang
Ses05M_script01_2_F017,i cant help it,ang
Ses05M_script01_2_M016,what have i got to hide kate what the hell is the matter with you,ang
Ses05M_impro03_M000,guess what,hap
Ses05M_impro03_F000,what,neu
Ses05M_impro03_M001,i did it i asked her to marry me,hap
Ses05M_impro03_M002,yes i did it,hap
Ses05M_impro03_F002,when,hap
Ses05M_impro03_M003,oh my god it was just last weekend,hap
Ses05M_impro03_F003,oh what how where how did you do it,hap
Ses05M_impro03_M004,shewell she said yes first of all let me say that right off the bat well i would like to assume too but you never know these things right,hap
Ses05M_impro03_F004,okay good i i assumed,hap
Ses05M_impro03_F005,oh,hap
Ses05M_impro03_M006,i did it up at yosemite we went camping right like we usually do you know we go camping up there all the time but um the waterfalls had died down a little bit you know and so uh wei had her climb up,hap
Ses05M_impro03_M007,you know we did some you know some rock climbing up the waterfalls and went up to this little pool that was up there and then i its great um you have to climb this little rock,hap
Ses05M_impro03_F006,uhhuh,neu
Ses05M_impro03_M008,and you can climb it and its covered in algae you know so i wanted her to climb it to go take a picture like back in this little waterfall area and she got back there and she took her picture and then i had her come back and i was going to do the same thing,hap
Ses05M_impro03_M009,well instead i climb up on the rock and like i i didnt do it  well i did it on purpose i made it look like i accidentally did it i slipped down into this pool of water right and she freaks out because i slide all the way down this rock and um,hap
Ses05M_impro03_M010,and i pop up out of the water  and i had planned it already you know i pop up out of the water and i breathing and i like grab her hand you know and that in my hand ive got the ring,hap
Ses05M_impro03_M011,and shes like she feels it you know and she doesnt know what it is and she you know helps me get out and i wont let go of her hand and shes like what are you doing i and said you saved my life now will you marry me,hap
Ses05M_impro03_F007,oh my god thats so dramatic,hap
Ses05M_impro03_M012,wasnt that great i didnt want it to be too hokeybut but she liked itshe liked it,hap
Ses05M_impro03_F008,so cute,hap
Ses05M_impro03_F009,no its totally original though,hap
Ses05M_impro03_F010,oh,hap
Ses05M_impro03_M013,yeah and she said yes and she cried of course,hap
Ses05M_impro03_F011,oh then you had a whole weekend of camping,hap
Ses05M_impro03_M014,yes we did that in the beginning exactly so we had so we just had you know good times the rest of the weekend yeah,hap
Ses05M_impro03_F012,oh right sure laughter,hap
Ses05M_impro03_M015,it was a lot of fun it was a lot of fun shes great and im so happy,hap
Ses05M_impro03_F013,so where are you going to have your wedding,hap
Ses05M_impro03_M016,were going to do it back in the midwest where her family all is theyre all out there you know so um and so just gonna have a small small wedding but um you know of course youre going to come right,hap
Ses05M_impro03_F014,yeah of course,hap
Ses05M_impro03_F015,okay okay,hap
Ses05M_impro03_M018,um and she wants you to be in it too she loves you so much she thinks youre the sweetest of course you are youre youre my best friend so,hap
Ses05M_impro03_F016,where is she right now,hap
Ses05M_impro03_M019,oh shes back at work yeah,neu
Ses05M_impro03_F017,yeahill hang out with the both of you,hap
Ses05M_impro03_M020,of course well go out to dinner later this week,hap
Ses05M_impro03_F018,yes,hap
Ses05M_impro03_M021,it will be perfect,hap
Ses05M_impro03_F019,oh im so excited for you,hap
Ses05M_impro03_F020,oh,hap
Ses05M_impro03_M023,shes the one,hap
Ses05M_impro03_F021,oh my gosh you told your parents already and everything,hap
Ses05M_impro03_M024,of course i told them right away we called them all right them,hap
Ses05M_impro03_F022,are they so excited,hap
Ses05M_impro03_M025,oh yeah my moms freaking out oh yeah shes so happy this is you know its her dream come true she always wanted her little boy  she wants kids you know,hap
Ses05M_impro03_M026,she wants grandkids so well be working on that right away,hap
Ses05M_impro03_F023,are you guys gonna have kids,hap
Ses05M_impro03_M027,of course were gonna have kids like three at least,hap
Ses05M_impro03_M028,she wants like eight she wants like eight kids and im like no no no no no i am like what lets do maybe three and well go with that,hap
Ses05M_impro03_F026,are you going to start right away,neu
Ses05M_impro03_M029,well were going to take a little bit of time you know we need to get acclimated and you know start our lives make money you know be comfortable,hap
Ses05M_impro03_F027,yeah have you ever like lived with someone else before,neu
Ses05M_impro03_M030,oh yeah yeah yeah yeah i mean actually we lived together awhile back when we  yeah back in college for a little while yeah,hap
Ses05M_impro03_M031,but that so we are really used to each other we took the time apart and now were going to get back together were going to move in soon,hap
Ses05M_impro03_F030,oooh,neu
Ses05M_impro03_M032,its great im a lucky man,hap
Ses05M_impro03_F031,thats incredible yeah congratulations,hap
Ses05M_impro03_M033,thank you,hap
Ses05M_script01_3_F000,youre the only one i know who loves his parents,neu
Ses05M_script01_3_F001,its all right its a good thing its lovely here the air is sweet,hap
Ses05M_script01_3_M001,so youre not sorry i came,hap
Ses05M_script01_3_F003,well your mother first of all pretty much told me to leave,neu
Ses05M_script01_3_M003,well,neu
Ses05M_script01_3_F006,i figured they would your mother at least,neu
Ses05M_script01_3_F007,well from her perspective i mean why else would i come here,neu
Ses05M_script01_3_M010,you feel its wrong here dont you this yard this chair i want you to be ready for me annie i i dont want to win you away from anything,hap
Ses05M_script01_3_F009,oh chris ive been ready for a long time,hap
Ses05M_script01_3_F010,i almost got married two years ago,sad
Ses05M_script01_3_M013,you felt something that far back,hap
Ses05M_script01_3_F012,everyday since,hap
Ses05M_script01_3_F013,well i mean until then you never wrote and when you did what did you say i mean you sure can be ambiguous,hap
Ses05M_script01_3_M016,oh god i kissed annie i kissed annie i cant how long have i waited to do that,hap
Ses05M_script01_3_M017,oh annie were gonna live now im going to make you so happy,hap
Ses05M_script01_3_F015,not like that youre not,hap
Ses05M_script01_3_F016,like larrys brother do it like you chris whats the matter,sad
Ses05M_script01_3_M019,lets go for a ride i i i want to be alone with you,sad
Ses05M_script01_3_M020,no nothing like that,sad
Ses05M_script01_3_F019,even in your letters there was something ashamed,sad
Ses05M_script01_3_M021,yeah i suppose i have been but its going for me,sad
Ses05M_script01_3_F020,you have to tell me,sad
Ses05M_script01_3_M022,i dont i dont know where to start,neu
Ses05M_script01_3_F021,it wouldnt work like this,sad
Ses05M_script01_3_M023,its so mixed up with so many other things,sad
Ses05M_script01_3_F022,yeah sure,neu
Ses05M_script01_3_M025,i lost them,sad
Ses05M_script01_3_F023,how many,sad
Ses05M_script01_3_M026,just about all,sad
Ses05M_script01_3_M027,it it takes time to toss something like that offi mean because they werent just men,sad
Ses05M_script01_3_M029,i know its its just a little thing but thats just the kind of guys i had they didnt die they killed themselves for each other,sad
Ses05M_script01_3_M030,i mean that exactly anymore selfish  just a little bit more selfish and they would have been here today and it gave me an idea as i was watching them all go down,sad
Ses05M_script01_3_M033,it was and then i went home and it was incredible it didnt have any meaning there,sad
Ses05M_script01_3_M036,i felt what you said ashamed somehow because nobody had changed at all,sad
Ses05M_script01_3_M039,and i guess that included you,sad
Ses05M_script01_3_F024,do you still feel like that,sad
Ses05M_script01_3_M040,i want you now annie,sad
Ses05M_script01_3_F025,because you cant feel like that anymore chris because everything you have you have a right to me included,sad
Ses05M_script01_3_M041,oh annie,hap
Ses05M_script01_3_F027,laughter what will i do with a fortune,hap
Ses05M_script01_3_M042,annie i am going to make you a fortune,hap
Ses05M_script03_1_M001,i wonder,hap
Ses05M_script03_1_F001,what nobody knows we are here except freda and she wouldnt ring up,hap
Ses05M_script03_1_F002,what do we do,hap
Ses05M_script03_1_M003,were all right arent we darling whatever happens,neu
Ses05M_script03_1_F003,now and always my sweet,hap
Ses05M_script03_1_M004,i dont care then,hap
Ses05M_script03_1_F004,it was bound to happen sooner or later,hap
Ses05M_script03_1_F005,oh it sent shivers up my spine,hap
Ses05M_script03_1_M006,oh what shall we do if they suddenly walk in on us,hap
Ses05M_script03_1_M007,with the worst with the most perfect poise,hap
Ses05M_script03_1_M008,uhh its amazing how once you feel,hap
Ses05M_script03_1_M009,things that ought to matter most dreadfully dont matter at all when ones happy do they,hap
Ses05M_script03_1_M010,uhh you mustnt say that my darling,hap
Ses05M_script03_1_M011,being that sacred and wonderful thing love,hap
Ses05M_script03_1_M012,um what does it all mean thats what i ask myself in my endless quest for ultimate truth dear god what does it all mean,hap
Ses05M_script03_1_F011,dont laugh at me im serious,neu
Ses05M_script03_1_M013,you mustnt be serious darling thats just what they want,hap
Ses05M_script03_1_F012,whos they,neu
Ses05M_script03_1_M014,all the futile mortals who try to make life unbearable laugh at them be flippant laugh at everything all their sacred shibboleths,hap
Ses05M_script03_1_M015,uh the being flippant brings out the acid in their damned beauty and light,hap
Ses05M_script03_1_F013,if i laugh at everything then i must laugh at us too,neu
Ses05M_script03_1_M016,certainly you must we are figures of fun all right,hap
Ses05M_script03_1_F015,well will we always bicker and fight,neu
Ses05M_script03_1_M018,no that fire will fade along with our passion,hap
Ses05M_script03_1_F017,what if one of us dies does the other one laugh then,neu
Ses05M_script03_1_M020,yes yes with all his might,hap
Ses05M_script03_1_M021,no no that is quit laughable the cutting little mystery all done with mirrors,hap
