Utterance_ID,Text,Emotion
Ses02F_impro05_M020,all right miss ii know i realize this but like i said there are several people that are in your same situation so um its notits not totally uncommon and im actually gonna have to ask you to move so i can help the next person,neu
Ses02F_impro05_M021,yes all right there you go now you can file a claim over to the leftand theyll help you out,neu
Ses02M_script02_1_M000,what time is it theyre supposed to run around midnight,hap
Ses02M_script02_1_M001,god this great isnt it like look at the night we go here it couldnt be better,hap
Ses02M_script02_1_M003,how you doing,hap
Ses02M_script02_1_F000,fine,neu
Ses02M_script02_1_M004,is that  is that no was that just foam i cant even tell,hap
Ses02M_script02_1_M005,although i guess you cant tell it probably isnt them probably be unmistakable dont you think,hap
Ses02M_script02_1_M006,how you doing you know what i forgot i forgot to bring my flashlight how  how could i forget to bring my flashlight how could i be so stupid,hap
Ses02M_script02_1_F001,what flashlight,neu
Ses02M_script02_1_F005,yea,neu
Ses02M_script02_1_M013,you cold you want my jacket we shouldve  we shouldve brought our blanket our blanket how could we forget to bring the blanket,hap
Ses02M_script02_1_M014,oh a sixpack thats shouldve brought a  a sixpack be just the ticket right now how could i forget,hap
Ses02M_script02_1_M015,oh man like a kid its amazing i got out of the house with my fly zipped,hap
Ses02M_script02_1_M016,you think they can hear us talk or feel the vibrations in the sand when we move around,hap
Ses02M_script02_1_F006,im cold,neu
Ses02M_script02_1_F011,not particularly,neu
Ses02M_script02_1_M023,honey this is a natural phenomenon i mean it only happens once a year,hap
Ses02M_script02_1_M024,think about the people in kansas they theyd have to get a plane ticket and hotel reservations to see this we live forty minutes away its too good to pass up,hap
Ses02M_script02_1_M025,yea but that moment on the beach is the highlight of their little lives i mean all that flopping is laying eggs or what do you mating or spotting or something like that,hap
Ses02M_script02_1_M026,this is a big night for these guys lifes last orgy,hap
Ses02M_script02_1_M028,okay but its fish that do something none of the other fish do like the swallows returning to capistrano or the lemmings throwing themselves off the cliffs,hap
Ses02M_script02_1_M029,you know there is like there is a certain mystery here a magic a bit of the unexplainable i dont see how you cannot be interested,hap
Ses02M_script02_1_F016,im just not,sad
Ses02M_script02_1_F017,yes,neu
Ses02M_script02_1_F018,last year youll also remember our shoes got wet i got sand in my panties you got a sore throat we got into a big fight over nothing and we didnt see the grunions,ang
Ses02M_script02_1_M035,there is that oh no thats just seaweed isnt it,hap
Ses02M_script02_1_M036,this is this is great isnt it i wouldnt miss this for anything now listen to this i know youre not interested but just listen,hap
Ses02M_script02_1_M037,out there somewhere there is this huge mass of silver fish headed this way,hap
Ses02M_script02_1_M038,they dont why we dont know why they didnt take a vote or anything they didnt get a map or an invitation,hap
Ses02M_script02_1_M039,just all as one this little time sensitive firecracker instinctual firecracker in their body just went off and all as one they turned and formed a line as long the california coast and started swimming theyre swimming right now as if thats the only thing that matters,hap
Ses02M_script02_1_M040,its single mindedness with no mind its urgency thats pure urge they dont know what drives them they dont ask it a name or ask it a question,hap
Ses02M_script02_1_M041,they just turn as one and start the swim and brings them right here to this spot where we stand for a massive celebration of sex and death,hap
Ses02M_script02_1_M042,look at me im giving myself goose bumps all my hairs are popping up,hap
Ses02M_script02_1_F020,thats the wind,neu
Ses02M_script02_1_F021,about what,neu
Ses02M_script03_1_F002,what are we going to do,hap
Ses02M_script03_1_F003,now and always sweet,hap
Ses02M_script03_1_M005,hello hello what wrong number,hap
Ses02M_script03_1_F005,oh it sends shivers down my spine,hap
Ses02M_script03_1_F006,behave exquisitely,hap
Ses02M_script03_1_M007,with the most perfect poise,hap
Ses02M_script03_1_F007,yes i should probably to a court curtsey,hap
Ses02M_script03_1_M008,things that ought to matter dreadfully dont matter at all when ones is happy do they,hap
Ses02M_script03_1_M009,oh darling dont say that,sad
Ses02M_script03_1_M010,meaning that sacred and beautiful thing love,hap
Ses02M_script03_1_M011,what does it all mean thats what i ask thats what i ask myself in my ceaseless quest for ultimate truth good god what does it all mean,hap
Ses02M_script03_1_M012,you mustnt be serious my dear one thats just what they want,hap
Ses02M_script03_1_F012,whos they,hap
Ses02M_script03_1_M014,flippancy brings out the acid in their damned sweetness in light,hap
Ses02M_script03_1_M015,certainly you must we figures of fun all right,hap
Ses02M_script03_1_M016,no that desire will fade along with our passion,sad
Ses02M_script03_1_F015,oh dear should we like that,sad
Ses02M_script03_1_M018,yes yes with all his might,hap
Ses02M_script03_1_M019,no no it isnt death is very laughable such a cunning little mystery all done with mirrors,hap
Ses02M_script03_1_M020,so is everyone else in the long run,hap
Ses02M_script03_1_M021,lets be superficial and pity the poor philosophers lets blow our trumpets and squeakers and enjoy the party as much as we can like quite idiotic very small school children lets savor the delight of the moment,hap
Ses02M_script03_1_M022,come kiss me darling before your body rots and worms pop in and out of your eye sockets,hap
Ses02M_script03_1_M024,you remember that awful scene we had in venice,hap
Ses02M_script03_1_F021,which particular one,hap
Ses02M_script03_1_F022,oh charles that was his name charles it did wiggle so beautifully,hap
Ses02M_script03_1_F023,i know you did you threw it out of the window into the grand canal i dont think ill ever forgive you for that,hap
Ses02M_script03_1_F024,it went on intermittently for days,hap
Ses02M_script03_1_F025,it burned my comb too and all the towels in the bathroom,hap
Ses02M_script03_1_M029,that was a rouser wasnt it,hap
Ses02M_script03_1_F027,the manager came in and found us rolling around on the floor biting and scratching like panthers,hap
Ses02M_script03_1_M031,ill never forget his face,hap
Ses02M_script03_1_F028,oh it was ridiculous completely ridiculous,hap
Ses02M_script03_1_F029,and very much sillier,hap
Ses02F_script01_3_M001,youre not sorry you came,neu
Ses02F_script01_3_F009,from her point of view why else would i come,sad
Ses02F_script01_3_M010,you feel its wrong here dont you this yard this chair i want you to be ready for me i dont want to have to win you away from anything,hap
Ses02F_script01_3_F012,i almost got married two years ago,hap
Ses02F_script01_3_F013,you started to write me and,hap
Ses02F_script01_3_F014,every day since,hap
Ses02F_script01_3_F016,i will never forgive you why did you wait all these years all i did was sit and wonder if i was crazy for thinking of you,hap
Ses02F_script01_3_M020,no nothing like that,sad
Ses02F_script01_3_F020,then whats wrong i mean even in your letters there was somesomething ashamed,sad
Ses02F_script01_3_M021,yeah i suppose i have been but its going from me,sad
Ses02F_script01_3_F021,youve gotta tell me,sad
Ses02F_script01_3_M022,i dont know how to start,sad
Ses02F_script01_3_F022,it wouldnt work this way,sad
Ses02F_script01_3_M023,its all mixed up with so many other things you remember overseas i was in command of a company,sad
Ses02F_script01_3_F023,yeah sure,sad
Ses02F_script01_3_M024,well i lost them,sad
Ses02F_script01_3_F024,how many,sad
Ses02F_script01_3_M025,just about all,sad
Ses02F_script01_3_F025,oh gee,sad
Ses02F_script01_3_M026,it takes some time for a guy to toss that off cause they werent just men,sad
Ses02F_script01_3_M027,for instance one time it had been raining several days and this kid came to me and gave me his last pair of dry socks i put them in pocket its only a little thing but thats the kind of guys i had,sad
Ses02F_script01_3_M028,they didnt die they killed themselves for each other i mean that exactly a little more selfish and theyd have been here today,sad
Ses02F_script01_3_M029,i got this idea watching them go down everything was being destroyed see but it seemed that there was one new thing being made a sort of responsibility man for man,sad
Ses02F_script01_3_M030,you know what i mean to show that to bring that onto the earth again like some kind of monument and everyone would feel it standing behind him and it would make a difference to him,sad
Ses02F_script01_3_M031,then i came back and it was incredible there was no meaning in it here the whole thing to them seemed like sort of a bus accident i went to work with dad and that rat race again,sad
Ses02F_script01_3_M032,and i felt what you said ashamed somehow cause nobody was changed at all it seemed to make suckers out of a lot of guys i felt wrong to be alive to open the new bank book drive the new car see the new refrigerator,sad
Ses02F_script01_3_M033,i mean you can take those things out of a war but when you drive that car youve gotta know that it came out of the love a man can have for a man youve gotta be a little better because of it,sad
Ses02F_script01_3_M034,because otherwise all you have is really loot and theres blood on it and i didnt want to take any of it and i guess that included you,sad
Ses02F_script01_3_F026,you still feel that way,sad
Ses02F_script01_3_F029,whatll i do with a fortune,hap
Ses02F_impro03_F000,oh my god guess what guess what guess what guess what guess what guess what,hap
Ses02F_impro03_F001,well guess guess guess guess guess,hap
Ses02F_impro03_M001,um you,neu
Ses02F_impro03_M004,that is great you look radiant i shouldve guess,hap
Ses02F_impro03_F004,im so excited,hap
Ses02F_impro03_M005,well tell me about him what happened,hap
Ses02F_impro03_F009,like all they have and i was like whats going on and he like takes my hand and pulls me into the middle and hes likeyou know gets on his knee and everythingand says will you marry me and i flipped out,hap
Ses02F_impro03_F011,cause cause he was with me you didnt do it did you,hap
Ses02F_impro03_M009,yeah i mean candles wouldnt stayno i didnti didnt know anything about it,hap
Ses02F_impro03_F012,you didnt know anything,hap
Ses02F_impro03_M010,no im just as happy as you are this is,hap
Ses02F_impro03_F013,i was justit was so like i thought this might happen eventually but like not yet you know what i mean like,hap
Ses02F_impro03_M011,so i meanits good though,hap
Ses02F_impro03_F014,it is good its totally good i mean it like oh you know,hap
Ses02F_impro03_M012,yeah i know wow im shaking i cant even,hap
Ses02F_impro03_F015,i know so were gonna take itlike were not gonna get married right awaycause we want to like have plenty of time to plan everything out,hap
Ses02F_impro03_F016,and um my parents want to like be part of it and help out and everythingso we want to give it lots of time to like,hap
Ses02F_impro03_M013,oh do theydo they know yet have you told them oh thats,neu
Ses02F_impro03_F017,yeah yeah i called them i called them and of course they were so excited cause they love him like they always have um,hap
Ses02F_impro03_M014,thats great yeah,neu
Ses02F_impro03_F018,so yeah i mean itll be good we wanna like uh i think were gonna have it in spring time like early springso its no too hot yet and um,hap
Ses02F_impro03_M015,okay you knowyou know where or,neu
Ses02F_impro03_F019,i dont know i mean i kinda like the idea of having something outside butlikeis a yeah,hap
Ses02F_impro03_M016,uh huh i mean you know its springitll be,neu
Ses02F_impro03_M017,springs nice though,neu
Ses02F_impro03_F021,yeah i dont knowlaughteri meani cant eventhe whole idea of like livingspending my whole life with somebodythats crazy,hap
Ses02F_impro03_M018,yeah that ishow long you guys been together now,neu
Ses02F_impro03_M019,okay all right solaughterquite a while i meanthats thats good im so happy for you laughter,hap
Ses02F_impro03_F023,thank you thank you so much,hap
Ses02F_impro03_M020,yeah id love to be in that same situation some day but wow so,hap
Ses02F_impro03_F024,oh you willyoull find just the right girl and shell be perfect for you and everything will be great,hap
Ses02F_impro03_M022,oh i approve ilaughteri more than approve,hap
Ses02F_impro03_M023,i mean im surprised he didnt ya knowgo get a plane to fly over and shinebut candles on the beach thats okay too i guess,hap
Ses02F_impro03_F026,yeah its pretty good,hap
Ses02F_impro03_M024,wellcani mean let me knowi want i want invitations and,hap
Ses02F_impro03_F027,of course of courseyoull be able to be a part of it you can come help me pick my colors,hap
Ses02F_impro03_M025,oh yes this is the whole garbage,hap
Ses02F_impro03_F028,its so girly i dont even know how to likeits so weird but itll be fun my mom will love to be likeshell get so into it im sure,hap
Ses02F_impro03_F029,shell be likeflowers and the,hap
Ses02F_impro03_M026,itll be good wow thats great,hap
Ses02F_impro03_F030,oh thank you laughter,hap
Ses02F_script02_2_M000,well so what do you think,hap
Ses02F_script02_2_F000,about what,neu
Ses02F_script02_2_M001,what i was saying,neu
Ses02F_script02_2_M002,it certainly is not its slightly exaggerated scientific fact,neu
Ses02F_script02_2_M003,well im not the only one look at all these people,neu
Ses02F_script02_2_M005,carla can i ask you something dont take this wrong but are you having your period,neu
Ses02F_script02_2_F005,god damn it augie dont ask me that i hate it when you ask me that you always ask me that its insulting,ang
Ses02F_script02_2_F006,we just have different ideas of what this evening is supposed to look like,ang
Ses02F_script02_2_M007,theres nothing to it we come here the grunion arrive they do their little fish business we go ooh ah look at the fish they go home we go home,neu
Ses02F_script02_2_M009,weve missed them twice thats not ever,neu
Ses02F_script02_2_M010,well well see them this year,neu
Ses02F_script02_2_F011,i mean i feel like my whole life is gonna be spent standing on the beach with my eyes wide open and my hands clasped expectantly waiting for the fish to show up and the fish wont show up,ang
Ses02F_script02_2_M013,its just fish nothing to get traumatized about,neu
Ses02F_script02_2_M016,you said hey the grunion are running tonight i said great lets go i feel lucky,neu
Ses02F_script02_2_M017,okay so im putting on my jacket putting out the animals getting the car out of the garage,neu
Ses02F_script02_2_F015,do you remember the first time we came to see it it was about four years ago right after we got married,sad
Ses02F_script02_2_F016,i thought i was pregnant you had a bottle of champagne but no glasses you asked me to dance so we kicked off our shoes and you popped the cork,sad
Ses02F_script02_2_F017,and while we were dancing you said the softest most intimate things to me right into my ear so that i could feel them as much as hear them,sad
Ses02F_script02_2_F018,and i remember thinking this is it you know at lastat last i am as happy as i am supposed to be,sad
Ses02F_script02_2_M018,wait a minute ive got it,neu
Ses02F_script02_2_F019,just dancing barefoot in the sand drinking champagne out of the bottle,sad
Ses02F_script02_2_M019,it was in the car right driving past the knickerbocker liquor locker you said lets get some champagne and i said times a wasting or something like that right,neu
Ses02F_script02_2_M020,yeah of course i see it now you want this to be like that other time right thats it right,neu
Ses02F_script02_2_F020,id rather not remember some things i would rather not hope for some things,sad
Ses02F_script02_2_M021,okay yeah sure i see it now listen you wanna dance,neu
Ses02F_script02_2_F021,no,sad
Ses02F_script02_2_M022,you want me to go get some champagne,neu
Ses02F_script02_2_F022,no,sad
Ses02F_script02_2_M023,take off our shoes,neu
Ses02F_script02_2_F024,no,sad
Ses02F_script02_2_M029,well welcome to the human race do you think this is what i had in mind when i proposed that four years down the road wed be at the beach yelling at each other over fish,ang
Ses02F_script02_2_M031,no carla im just like you i thought it was gonna be all peaches and roses and sand in our toes and wind in our hair and the fish will always come and the bills will pay themselves and well have three fat rosy kids and ha ha baby the jokes on us,sad
Ses02F_script02_2_M033,yes it is,neu
Ses02F_script02_2_M034,right,neu
Ses02F_script02_2_F031,well this isnt anything like i thought anything would be like,sad
Ses02F_script02_2_M035,i know me neither,sad
Ses02F_script02_2_M036,im doing the best i can,sad
Ses02F_script02_2_F033,i know that augie really i do,sad
Ses02F_script02_2_F034,i know that you meant this to be special and nice and the sand and the moon and all but i just couldnt help thinking about being somewhere else,sad
Ses02F_script02_2_M037,maybe if you were with somebody else too,sad
Ses02F_script02_2_F035,i didnt say that,sad
Ses02F_script02_2_M038,no i know but still i know i dont make you happy,sad
Ses02F_script02_2_F038,youre the one who probably wishes you were with someone else someone whoyoud rather enjoy yourself and didnt take everything so hard,sad
Ses02F_script02_2_M041,i dont know it seemed like a pretty good spot to me i mean look at the view you have of the moon from here,hap
Ses02F_script02_2_M042,well look what we have here,hap
Ses02F_script02_2_F041,augie you brought refreshments,hap
Ses02F_script02_2_M043,its not champagne,hap
Ses02F_script02_2_F042,well then we dont need glasses,hap
Ses02F_script02_2_F043,no i think you might be right maybe this is the spot after all,hap
Ses02F_script02_2_F044,augie im sorry,sad
Ses02F_script02_2_M045,shh if were very quiet the fish might come,hap
Ses02F_script02_2_F045,or not,hap
Ses02F_script02_2_M046,or not,hap
Ses02M_script03_2_M000,as a matter of fact the real cause of that row was peter burden,neu
Ses02M_script03_2_F000,you knew there was nothing in that,hap
Ses02M_script03_2_M001,i knew nothing of the sort you took presents from him,ang
Ses02M_script03_2_F001,presents just a trivial little broach,hap
Ses02M_script03_2_F002,no it wasnt it was very pretty i still have it and i wear it often,neu
Ses02M_script03_2_M003,you went out of your way to torture me over peter burden,ang
Ses02M_script03_2_F003,no i didnt you worked the whole thing up in your jealous imagination,neu
Ses02M_script03_2_M005,you let him kiss you you said you did,ang
Ses02M_script03_2_F005,what of it,neu
Ses02M_script03_2_F006,it gave him a lot of pleasure it didnt hurt me any,neu
Ses02M_script03_2_M007,what about me,ang
Ses02M_script03_2_F007,well if you hadnt been so nosey and suspicious you never wouldnt have known anything about it,neu
Ses02M_script03_2_F009,no thanks,neu
Ses02M_script03_2_M010,i have a little i think,neu
Ses02M_script03_2_M011,no particular reason anyhow they are very small ones,neu
Ses02M_script03_2_F011,it just seems so silly to go on and on and on with such a thing,neu
Ses02M_script03_2_M012,you can hardly call three liquor glasses in a whole evening going on and on and on,neu
Ses02M_script03_2_F012,well its become a habit with you,neu
Ses02M_script03_2_F014,what,ang
Ses02M_script03_2_F015,no im just making myself fascinating for you,neu
Ses02M_script03_2_M016,going out somewhere dear,neu
Ses02M_script03_2_M018,as a matter of fact thats perfectly true,neu
Ses02M_script03_2_F019,be quiet,ang
Ses02M_script03_2_F023,i dont care do you understand i dont care i dont care if they bark or roll about like hoops,ang
Ses02M_script03_2_M024,tell me did you see much of peter burden after our divorce,neu
Ses02M_script03_2_F024,yes i did quite a lot,neu
Ses02M_script03_2_M026,what riotous time you must have had,ang
Ses02M_script03_2_M027,no restraint at all very enjoyable never had much anyhow,ang
Ses02M_script03_2_F028,oh be quiet,ang
Ses02M_script03_2_M031,we can get a good little debate going about that dont you think intemperate tots,ang
Ses02M_script03_2_M032,all right i will,neu
Ses02M_script03_2_M033,better turn that off i think,neu
Ses02M_script03_2_F035,you are far too temperamental try to control yourself,ang
Ses02M_script03_2_M039,turn it off,ang
Ses02M_script03_2_F036,stop it stop it i hate you,ang
Ses02M_script03_2_M040,amanda listen listen,ang
Ses02M_script03_2_F037,listen indeed im sick and tired of listening to you damn sadistic bully,ang
Ses02M_script03_2_M041,very amusing indeed,ang
Ses02M_script03_2_F038,stop it stop it i hate you do you hear youre overbearing and conceited and utterly impossible,ang
Ses02M_script03_2_M042,youre a vile tempered loose living wicked little beast and i hope i never see you again as long as i live,ang
Ses02M_script03_2_F039,this is the end do you hear the end finally and forever,ang
Ses02M_script03_2_M043,youre not going like this,ang
Ses02M_script03_2_F040,oh yes i am,ang
Ses02M_script03_2_M044,youre not,ang
Ses02M_script03_2_F041,yes i am let go of me youre cruel fiend and i hate and loathe you thank god i realized who you really are before i would ever ever marry you again i would never marry you again id rather die in torment,ang
Ses02M_script03_2_M045,shut up,ang
Ses02M_script03_2_M046,shut up,ang
Ses02M_script03_2_M047,i wouldnt marry you again if you came to me on your bended knees youre a evil minded little vampire i hope to god i never see you again as long as i live,ang
Ses02M_script03_2_F042,youre a beast i hate you stop it stop it,ang
Ses02M_impro07_F000,oh yeah have you gotten letters yet,hap
Ses02M_impro07_F001,um i dont know where,hap
Ses02M_impro07_M002,usc,hap
Ses02M_impro07_F003,oh my gosh thats so cool,hap
Ses02M_impro07_F004,laughter its gotta be it like,hap
Ses02M_impro07_F005,oh my gosh thats so cool,hap
Ses02M_impro07_M006,but big packet big packet is nice,hap
Ses02M_impro07_F006,big packet is gotta be the real thing yeah,hap
Ses02M_impro07_M007,so its like yes rip it open and there it is big  oh yes,hap
Ses02M_impro07_F007,oh my gosh i thought there was like maybe going to be some like i dont know if you are going to get in or not so im really glad that you did,hap
Ses02M_impro07_F008,thats so cool,hap
Ses02M_impro07_M008,yeah i know i know,hap
Ses02M_impro07_M009,it was you know i wasnt too sure i mean you know it was kind of last minute for like the application,hap
Ses02M_impro07_M010,and everything like but,hap
Ses02M_impro07_F009,yeah totally,hap
Ses02M_impro07_M011,it was good yeah i mean,hap
Ses02M_impro07_F010,so youre going to be right here in los angeles that is so cool,hap
Ses02M_impro07_M013,im looking forward to it,hap
Ses02M_impro07_F011,so can we hang out,hap
Ses02M_impro07_M014,hey yes you know thats  thats what im coming for,hap
Ses02M_impro07_F012,yay,hap
Ses02M_impro07_M015,youre half the reason im going laughter,hap
Ses02M_impro07_F013,oh yay thank you laughter,hap
Ses02M_impro07_F014,no but thats an awesome school thats so cool,hap
Ses02M_impro07_F015,oh totally totally,hap
Ses02M_impro07_M017,you know what i mean i bet the home games are just like nuts you know,hap
Ses02M_impro07_F016,you get to like be a part of that,hap
Ses02M_impro07_F017,like you get to be a part of that like the like the like a cult,hap
Ses02M_impro07_M018,what,hap
Ses02M_impro07_M019,laughter i know i mean part of,hap
Ses02M_impro07_F018,laughter like a like a laughter no but i mean like everywhere you go people know who you are,hap
Ses02M_impro07_M020,yeah right a cult im looking forward to being in the cult,hap
Ses02M_impro07_M021,right i know like you it wont hurt i mean national champions last year wow you know,hap
Ses02M_impro07_M022,maybe well do it again this year,hap
Ses02M_impro07_F019,so you know what you are going to do there,hap
Ses02M_impro07_M023,whats that ahh well you know im im thinking um im leaning towards like communications,hap
Ses02M_impro07_M024,ii dont know kind of a broad,hap
Ses02M_impro07_F020,okay they have a lot of good schools right,hap
Ses02M_impro07_M025,yeah i mean a lota lot of good stuff oh yeah i mean its its just a really good school so really whatever i pick i cant go wrong i mean im just,hap
Ses02M_impro07_M026,im looking forward to getting there i mean god the campus is cool you know its like all just very confined i mean just you know its a college campus you know its like,hap
Ses02M_impro07_F021,yes its intimate,hap
Ses02M_impro07_F022,i know its so cool,hap
Ses02M_impro07_F023,fair for you wow oh my gosh,hap
Ses02M_impro07_M029,i mean you got to  you got to show me the ropes cause ive never been there before so i mean you know your way around already and laughter,hap
Ses02M_impro07_F024,i will do the best i can,hap
Ses02M_impro07_F025,well there are all kinds of awesome secrets so youll really enjoy it its really great im so glad,hap
Ses02M_impro07_M030,oh alright,hap
Ses02M_impro07_M031,imim looking forward to that breathing man so yeah i think im going to come out a little early so i mean ill give you a call and well definitely,hap
Ses02M_impro07_F026,yay,hap
Ses02M_impro07_F027,okay yes totally come visit,hap
Ses02M_impro07_F028,and well explore and you going to have such a good time youre going to fit in so well its going to be awesome,hap
Ses02M_impro07_M032,laughter thanks yes thanks yes thatll be cool,hap
Ses02M_impro07_F029,so congratulations thats awesome,hap
Ses02M_impro05_M000,hi um,neu
