Utterance_ID,Text,Emotion
Ses05F_script01_3_F000,youre the only one i know who loves his parents,hap
Ses05F_script01_3_M000,i know its going out of style isnt it,hap
Ses05F_script01_3_F001,no its good,hap
Ses05F_script01_3_F002,its so lovely here the air is sweet,hap
Ses05F_script01_3_F003,no but im not going to stay,hap
Ses05F_script01_3_M004,what,neu
Ses05F_script01_3_F006,well sort of embarrassed soon as i came,sad
Ses05F_script01_3_M005,well the plan was to kind of sneak up on you over a period of a week or so but uh they take it for granted that were all set,hap
Ses05F_script01_3_M006,how did you know,neu
Ses05F_script01_3_F008,well from her point of view why else would i come,neu
Ses05F_script01_3_F009,i guess this is why i came,hap
Ses05F_script01_3_M008,anne i love you i love you a great deal i love you,hap
Ses05F_script01_3_M009,i i i have no imagination thats all i know what to say iim embarrassing you i i didnt want to tell you here i wanted it to be some place different some place where we could be new to each other you know,hap
Ses05F_script01_3_M010,you feel its wrong here dont you this yard this chair i want you to be ready for me annie i dont want to win you away from anything,hap
Ses05F_script01_3_M016,oh god i kissed annie i cant believe i kissed annie how long ive wanted to do this,hap
Ses05F_script01_3_F015,ill never forgive you why did you wait so long all this time ive been wondering if i was a fool for thinking of you,hap
Ses05F_script01_3_M017,oh annie were going to live now im going to make you so happy,hap
Ses05F_script01_3_F016,not like that youre not,hap
Ses05F_script01_3_F017,like larrys brother do it like you chris chris whats the matter,hap
Ses05F_script01_3_M021,yeah i suppose i have been but its going from me,sad
Ses05F_script01_3_F020,it wouldnt work like this,sad
Ses05F_script01_3_M023,its its mixed up with so many other things i,sad
Ses05F_script01_3_M024,remember when i was overseas i was in command of the company,sad
Ses05F_script01_3_F021,yeah sure,neu
Ses05F_script01_3_M025,yeah i lost them,sad
Ses05F_script01_3_F022,how many,sad
Ses05F_script01_3_M026,just about all,sad
Ses05F_script01_3_F023,oh gee,sad
Ses05F_script01_3_M027,takes a little time to toss something like that off you know because they werent just men,sad
Ses05F_script01_3_M028,for instance theres this one time it had been raining for several days and this kid came up to me and gave me his last pair of dry socks you know he just put them in my pocket,sad
Ses05F_script01_3_M029,i know that thats not a big thing but its just the kind of guys i had they didnt die they they killed themselves for each other,sad
Ses05F_script01_3_M030,i mean that exactly thata little more selfish and they would have still been here today,sad
Ses05F_script01_3_M031,and i got an ideal watching them all go down everything was being destroyed see and,sad
Ses05F_script01_3_M032,but it seemed to me that something new was being created at the same time a kind of responsibility man for man do you understand me,sad
Ses05F_script01_3_M033,and to show thattoto bring that back onto the earth again like a like a monument and everyone would have it standing behind them and and it would make a difference for them,sad
Ses05F_script01_3_M034,and then i went home and it was incredible it had no meaning here,sad
Ses05F_script01_3_M035,it was all like some kind of bus accident to them i went back to work with my dad in that whole rat race again,sad
Ses05F_script01_3_M036,and i felt what you said ashamed somehowbecause nobody had changed at all it seemed to make suckers out of a whole lot of guys and,sad
Ses05F_script01_3_M037,it felt wrong to be aliveto open that bankbook to buy that new car to look at that new refrigerator i mean you can take those things out of the war but if you drive that car you have to know that that comes from the love that a man has for a man and youve got to be a little bit better than that,sad
Ses05F_script01_3_F024,do you still feel like that,neu
Ses05F_script01_3_M039,i i want you now annie,hap
Ses05F_script01_3_F025,because you cant feel like that anymore chris you hear me i mean everything that you have you deserve and that includes me and your father your father put hundreds of planes in the air you should be proud a man should be paid for that,sad
Ses05F_script01_3_M040,oh annie annie i am going to make you a fortune,hap
Ses05F_script01_3_F026,what would i do with a fortune,hap
Ses05M_impro08_M000,dsl extreme can i help you,neu
Ses05M_impro08_M001,this happens every two weeks,neu
Ses05M_impro08_M002,youve lost your connection,neu
Ses05M_impro08_M003,okay,neu
Ses05M_impro08_M004,hmm mmm,neu
Ses05M_impro08_M005,has somebody tried to pin your site,neu
Ses05M_impro08_F005,uh yeah weve pinned it a couple of times,neu
Ses05M_impro08_M006,okay um well i dont know and it consistently happens every two weeks,neu
Ses05M_impro08_F006,pretty much yeah  i dont know if its like bad phone lines or something,neu
Ses05M_impro08_M007,well you know what does your dsl cable  you have dsl right,neu
Ses05M_impro08_F007,hmm mmm,neu
Ses05M_impro08_M008,okay does your dsl cable you know travel a long distance by any chance  does it go through any windows i mean is it ,neu
Ses05M_impro08_F008,yeah,neu
Ses05M_impro08_F009,it goes it goes like through doorways but it goes a long distance,neu
Ses05M_impro08_M009,okay is it being is it being compressed between anything by any chance because sometimes your connection can be you know disrupted by you know the cable being squished,neu
Ses05M_impro08_M010,yeah that can be that can create a bad connection and it wont always be a bad connection but it will be bad off and on,neu
Ses05M_impro08_F011,well i i can check that is there anything else we can do too like ill go through and check the line throughout the house but ,neu
Ses05M_impro08_M011,yeah well absolutely what we can  lets just go ahead and just do a basic diagnostic of your system first off okay can you go down to your start button,neu
Ses05M_impro08_F012,uh huh,neu
Ses05M_impro08_M012,okay and uh go ahead and click on run,neu
Ses05M_impro08_F013,all right,neu
Ses05M_impro08_M013,okay were gonna get your  a little black box is going to come up do you see that,neu
Ses05M_impro08_F014,yeah i see that,neu
Ses05M_impro08_M014,okay uh youve got your c calling go ahead and type in directory list,neu
Ses05M_impro08_F015,okay,neu
Ses05M_impro08_M015,and hit enter,neu
Ses05M_impro08_F016,okay,neu
Ses05M_impro08_M016,okay can you tell me what that says,neu
Ses05M_impro08_F017,uh it its like a bunch of different letter and numbers and stuff,neu
Ses05M_impro08_M017,okay okay and um letters and numbers and stuff uh can you  can you just type in ip address search and hit enter,neu
Ses05M_impro08_F018,uh huh okay,neu
Ses05M_impro08_M018,okay does it list your ip address there,neu
Ses05M_impro08_F019,uh yeah looks  no no its set to zeros,neu
Ses05M_impro08_M019,its set to zeros okay maybe thats our problem that could very well be our problem there somehow youve lost your ip address im not sure why that would happen every week it could be a cycling issue something like that but lets go ahead and type your ip address in again,neu
Ses05M_impro08_M020,well if it does happen again let me give you my direct number and you can call me actually ill give you my cell number um its ,neu
Ses05M_impro08_M021,of course we seriously yeah i mean obviously youve worked you know  i dont want to hassle you anymore,neu
Ses05M_impro08_F022,oh my god i cant even tell you how much of a relief that is i literally call and talk to five different people like last week it went off and i spent an hour and a half on the phone with different people and ive been doing that like every every other week for months now,hap
Ses05M_impro08_M022,i completely understand,neu
Ses05M_impro08_M023,absolutely and i just dont want that to happen to you anymore,neu
Ses05M_impro08_M024,absolutely its a new service we are offering,neu
Ses05M_impro08_F025,yeah accountability its awesome,hap
Ses05M_impro08_M025,uh huh uh huh we want you to be happy youre our customer youre the most important thing okay,neu
Ses05M_impro08_F026,wow you know i was thinking about changing internet providers but but that that really is enough to change my mind,hap
Ses05M_impro08_M026,great well that makes me very happy that makes us all happy here at dsl extreme is there anything else i can help you with,hap
Ses05M_impro08_F027,no im just gonna go have a fantastic day now,hap
Ses05M_impro08_M027,all right you have a wonderful day call us anytime,neu
Ses05M_impro08_F028,okay thanks,hap
Ses05M_impro08_M028,all right bye bye,hap
Ses05F_impro01_F000,hi i need an id,neu
Ses05F_impro01_M000,ahh yeah this is the wrong line im sorry you need to go back over to line two b thats where you should have started from,neu
Ses05F_impro01_M003,well i have no camera here i cant help you at all here maam i have forms for something completely different you need to go to a different place,neu
Ses05F_impro01_F008,so could i maybe get the form from you fill it out here and maybe you could,neu
Ses05F_impro01_F017,isnt there anything you can do just call over and ask them if i can go to the front of the line in the other line,ang
Ses05F_impro01_F018,why not,ang
Ses05F_impro01_F020,right well last time they told me it was this line and obviously its not true,ang
Ses05F_impro05_F000,hium i think my baggage was lost and i need to i guess file a claim or i dont know what,neu
Ses05F_impro05_M000,okay what flight were you on,neu
Ses05F_impro05_F001,umseventeen coming from ,neu
Ses05F_impro05_M001,on what airline,neu
Ses05F_impro05_F002,it was virgin atlantic coming from london,neu
Ses05F_impro05_M002,from london okay um and you went through all your proper checkpoints,neu
Ses05F_impro05_M003,so you havent seen your bags since africa you flew threw heath row to here,neu
Ses05F_impro05_F004,right,neu
Ses05F_impro05_F005,yeah,neu
Ses05F_impro05_M004,okay well let me see here i,neu
Ses05F_impro05_M005,it seems like it went through heath row i see it here uh,neu
Ses05F_impro05_F006,thats good,neu
Ses05F_impro05_M006,but uh i dont see it here in the airport yet uh,neu
Ses05F_impro05_M007,im not sure where it is we can absolutely keep an eye out for for it for you,neu
Ses05F_impro05_F007,well i cant leave without it i mean could you find out,neu
Ses05F_impro05_M008,well im not a miracle worker i dont know what i can do for you i dont have the bag right here,neu
Ses05F_impro05_M009,well as i told you it left heath row and it seems to have arrived here but if you cant find it thenare you sure you know what your bag looks like,neu
Ses05F_impro05_M010,okay and what is that what kind of bag is it,neu
Ses05F_impro05_F010,um its a travel backpack its green and gray its got my name on it and my information,neu
Ses05F_impro05_M012,are you sure,neu
Ses05F_impro05_M014,all right now um its green travel bag you couldnt find it and was there something important in it that you need it,neu
Ses05F_impro05_M015,sentimental value,neu
Ses05F_impro05_M016,right well i dont know what to tell you um what i can offer you is a fifty dollar voucher on your next flight,neu
Ses05F_impro05_M017,no i understand i mean its got to be tough all those sentimental things but um this is all i can do for you,neu
Ses05F_impro05_M018,well you know sometimes thatsreally i mean what else could we do,neu
Ses05F_impro05_F018,uh not lose the baggage in the first place i mean youre offering a service here i paid so much money for that ticket,ang
Ses05F_impro05_M019,well,neu
Ses05F_impro05_M022,lets lets just relax for a moment maam you understand obviously were going to do everything we can to keep all of your luggage here,neu
Ses05F_impro05_M023,obviously were not trying to lose your luggage do you really believe that were trying to lose your luggage maam,neu
Ses05F_impro05_F019,no but i mean like why cant why cant you find it where did it go who lost it,ang
Ses05F_impro05_F020,well i justi paid so much money for this ticket i feel like you guys should be able to getto offer me more than a fifty dollar voucher,ang
Ses05F_impro05_M025,well were talking about one bag you personally made it here didnt you,neu
Ses05F_impro05_F021,yeah meaning i didnt die in a fiery plane crash how convenient but um i paid two thousand dollar to ride your airline and i would really appreciate getting my bags there to my destination in one place,ang
Ses05F_impro05_F022,right but part of the agreement is that im paying so that i can take myself and my belongings with me,ang
Ses05F_impro05_F023,and that youre going to transport them safely from one place to another,ang
Ses05F_impro05_F024,thats all you can offer me i mean my the stuff in there is worth way more than fifty dollar,ang
Ses05F_impro05_M030,well i understand that did you buy flight insurance,neu
Ses05F_impro05_M031,well my hands are really tied then,neu
Ses05F_impro05_M032,well its like any kind of insurance you dontwhen you get it then you get more you know like if you,neu
Ses05F_impro05_M033,well of course not because youve got your backpack with you the whole time now if youyou said this was a travel bag why werent you carrying it on if it was so important,neu
Ses05F_impro05_M034,uh so it was really heavy,neu
Ses05F_impro05_M036,im sorry maam theres nothing else i can do my hands are really tied here i really wish there was something else i could do for you,neu
Ses05F_impro05_F031,i dont believe that for a second,ang
Ses05F_impro05_M037,well i dont know why you wouldnt believe that,neu
Ses05F_impro05_M039,well i have no way to give you more money im giving you as much money as i can and figuring as far as figuring out where you bag is,neu
Ses05F_impro05_F033,what do you mean as you can who makes up these rules,ang
Ses05F_impro05_M040,makes up,neu
Ses05F_impro05_F034,youre an autono autonomous human being you could you could go into the com,ang
Ses05F_impro05_M041,the airline makes these rules mom maam,neu
Ses05F_impro05_F041,no i dont think i am i like have a whole bunch of stuff that means a lot to me and i brought it you know from africa its not like i can just go back and get it whenever i want,ang
Ses05F_impro05_M048,right,neu
Ses05F_impro05_F042,its not like i can go to kmart and buy another,ang
Ses05F_impro05_M050,and while i really would love to be able to hand you your bag right now obviously i cant do that,neu
Ses05F_impro05_M051,so youd like the fifty dollar voucher,neu
Ses05F_impro05_M052,okay just fill out these three forms and um youll well have that sent to you within the next three weeks and of course well definitely keep an eye out for your bag,neu
Ses05F_impro05_M053,you have a wonderful day,neu
Ses05F_impro03_F000,okay so big news,hap
Ses05F_impro03_M000,what,hap
Ses05F_impro03_M001,come on what,hap
Ses05F_impro03_F001,im getting married,hap
Ses05F_impro03_F002,yeah,hap
Ses05F_impro03_M003,no way,hap
Ses05F_impro03_F003,yeah,hap
Ses05F_impro03_F004,uhhuh,hap
Ses05F_impro03_M005,no way when whenwhen when did it happen,hap
Ses05F_impro03_F005,just a couple days ago,hap
Ses05F_impro03_M006,oh my gosh,hap
Ses05F_impro03_M007,and you actually said yes i cant believe it i never thought you would get married,hap
Ses05F_impro03_F007,i know me neither,hap
Ses05F_impro03_M008,oh my gosh,hap
Ses05F_impro03_F008,right i thought i would be way older too i thought i would be i be at least thirty something,hap
Ses05F_impro03_M009,oh absolutely,hap
Ses05F_impro03_M010,well we always said wed be in our thirtieth when we got married and we were going to get married to each other if we didnt by then,hap
Ses05F_impro03_F009,yeah,hap
Ses05F_impro03_M011,thirty nine yeah i cant believe it so you broke our pact thanks a lot,hap
Ses05F_impro03_F011,sorry,hap
Ses05F_impro03_M012,thanks a lot well okay youve got to tell me the details what did he say where was it what happened,hap
Ses05F_impro03_M013,okay thats okay spontaneous is great spontaneous is awesome,hap
Ses05F_impro03_M020,am i in it,hap
Ses05F_impro03_F020,yeah yeah of course,hap
Ses05F_impro03_M027,cool perfect another chicagoite got to love it,hap
Ses05F_impro03_F027,its so weird too right that like you can grow up so near somebody and never know them until you travel hundreds of miles away,hap
Ses05F_impro03_F028,i know,hap
Ses05F_impro03_F029,right being like oh where are you from the us where in the us chicago where in chicago,hap
Ses05F_impro03_M030,laughter i am sil,hap
Ses05F_impro03_F030,knowing the neighborhood yeah its pretty bizarre,hap
Ses05F_impro03_M031,and now youre getting married,hap
Ses05F_impro03_F031,yeah,hap
Ses05F_impro03_M032,that is amazing you must be so excited did you tell your mom,hap
Ses05F_impro03_F032,mmhmm,hap
Ses05F_impro03_M033,oh did she cry,hap
Ses05F_impro03_F033,yeah she loves him,hap
Ses05F_impro03_F034,yeah sheyeah thats my type,hap
Ses05F_impro03_M035,breathing,hap
Ses05F_impro03_M036,you i cant believe it im so happy for you this is exactly what you wanted its your dream come true,hap
Ses05F_impro03_F035,thank you,hap
Ses05F_impro03_M037,the exact right guy i fully approve hes a wonderful guy we have a great time he can drink thats awesome,hap
Ses05F_impro03_F036,laughter,hap
Ses05F_impro03_M038,laughter,hap
Ses05F_impro03_F037,yeah we all have to hang out now,hap
Ses05F_impro03_M039,of course of course she will  of course she will yeah dont go and disappear like everyone else after they get married and i never see them again thatll make me mad you dont want to make me mad you know how i get when i get mad,hap
Ses05F_impro03_M040,exactly,hap
Ses05F_impro03_M041,exactly laugh,hap
Ses05F_impro03_F039,sorry,hap
Ses05F_impro03_F040,theres still time for that,hap
Ses05F_impro03_M043,oh thanks move here before you get married laughter,hap
Ses05F_impro03_F041,breathing,hap
Ses05F_impro03_M044,perfect okay good sigh,hap
Ses05F_impro03_M045,i dont feel so bad then well im excited for you,hap
Ses05F_impro03_F042,i know i cant believe it,hap
Ses05F_impro03_M046,i cant believe it,hap
Ses05F_impro03_F043,i am very excited,hap
Ses05F_impro03_M049,so i was one of the first ones that makes me feel so important,hap
Ses05F_impro03_F046,i have to think about moving now were going to move in together,hap
Ses05F_impro03_M050,oh yeah of course,hap
Ses05F_impro03_F047,i think its a good idea to live together before you get married,hap
Ses05F_impro03_M051,i think so too are you going to get a house or,hap
Ses05F_impro03_F048,i dont want a house i mean just,hap
Ses05F_impro03_F049,la apartment is fine,hap
Ses05F_impro03_F051,two artists though were bound to be poor forever,hap
Ses05F_impro03_M057,yeah,hap
Ses05F_impro03_M058,yeah,hap
Ses05F_impro03_F053,definitely not for a while,hap
Ses05F_impro03_F054,yeah,hap
Ses05F_impro03_F055,laughter good luck,hap
Ses05F_impro03_M060,laughter,hap
Ses05F_impro03_M061,oh thanks ill need it,hap
Ses05F_impro03_F056,you wont have trouble you wont have trouble,hap
Ses05F_impro03_M062,oh thanks youre too nice,hap
Ses05F_impro03_M063,just being polite now,hap
Ses05F_impro03_F057,you should just approach her like that hey will you bear my children,hap
Ses05F_impro03_M064,because i am not getting married,hap
Ses05F_impro03_M065,exactly laughter i think thatll go over great dont you,hap
Ses05F_impro03_F058,yeah totally,hap
Ses05F_impro03_M066,thats what girls like right,hap
Ses05F_impro03_F059,total turn on,hap
Ses05F_impro03_M067,would you mind popping out a few for me,hap
Ses05F_impro03_F060,laughter,hap
Ses05F_impro03_M068,thatd be great thanks,hap
Ses05M_impro06_M000,i just got some bad news,sad
Ses05M_impro06_M001,my friend shotty passed away,sad
Ses05M_impro06_F002,oh im so sorry,sad
Ses05M_impro06_M002,the end hes been sick for awhile he had cancer,sad
Ses05M_impro06_F003,oh my gosh,sad
Ses05M_impro06_M003,yeah its just i never thought it would actually happen you know i mean hes such a fighter and hes always so positive about everything,sad
Ses05M_impro06_M004,you know he was gonna and we  all the way up to the end we were just talking about how you know all the stuff we were gonna do and you know when he finally kicked this stupid cancer you know and we were gonna ,sad
Ses05M_impro06_M005,he wanted to travel you know and hes so talented probably the most talented person i have ever met in my entire life,sad
Ses05M_impro06_F004,what did he do,sad
Ses05M_impro06_M006,he was a designer you know but he did everything you know he painted and he and he did costume design he did set design he did lighting he was ,sad
Ses05M_impro06_M007,he just did everything he was literally literally the most talented guy i have ever met in my entire life,sad
Ses05M_impro06_M008,and hes gone now and i  i just cant believe it,sad
Ses05M_impro06_F005,yeah im so sorry,sad
Ses05M_impro06_M009,i mean one second you think you know youre just having a conversation and then ,sad
Ses05M_impro06_M010,you know sometimes you think you want to make that phone call or you think you want to tell somebody something or something like that do you know what i mean like thats  he was the person that i did that with you know like thats the person who i needed to call to tell things to all the time,sad
Ses05M_impro06_F006,you guys have been,sad
Ses05M_impro06_M011,and now i dont have that person anymore you know and its   its just you,sad
Ses05M_impro06_M012,you think that things get easier you know as you as you get older and you ,sad
Ses05M_impro06_M013,and it just gets worse it just gets worse everything is bad all the time people die your friends die family dies your best friends die its,sad
Ses05M_impro06_F007,im sorry i,sad
Ses05M_impro06_M014,you always think you know when you were you know when you were a little kid and you think something is gonna happen like it will all be better when i am older you know,sad
Ses05M_impro06_F008,wow ryan i know that you are hurting right now but i dont think you always feel like that,sad
Ses05M_impro06_M017,no youre right i dont youre right,sad
Ses05M_impro06_M018,even yeah  he doesnt he would never feel that way he would never want me to feel that way of course not but thats just where i am right now and   i dont know what else to do with it,sad
Ses05M_impro06_F009,yeah i understand i think its really healthy to grieve,sad
Ses05M_impro06_M019,i just miss him,sad
Ses05M_impro06_F010,if theres anything i can do to be there for you,sad
Ses05M_impro06_M020,thanks,sad
Ses05M_script01_1b_F000,whats he going to say maybe we ought to tell him before he sees it,sad
Ses05M_script01_1b_M001,he was out here when it broke,sad
Ses05M_script01_1b_M002,about four this morning i heard it crack and i looked out the window and he was standing right there when it cracked,sad
Ses05M_script01_1b_M003,i dont know but after he saw it he ran back into the house and started crying in the kitchen,sad
Ses05M_script01_1b_M004,no i figured it was best to leave him alone,sad
Ses05M_script01_1b_M005,yes yes he is i dont know the meaning in it but i know one thing mom we made a terrible mistake with dad,sad
Ses05M_script01_1b_M019,isnt it your business too if i tell dad and he throws a fit about it you have such a talent for ignoring things,ang
Ses05M_script01_1b_M020,shes not larrys girl,ang
Ses05M_script01_1b_M022,what to hell with that,ang
Ses05M_script01_1b_F022,have you asked annie yet,neu
Ses05M_script01_1b_F023,well how do you know shell marry you maybe she feels like your father does,neu
Ses05M_script01_1b_F024,the trouble is you dont see enough women you never did,neu
Ses05M_script01_1b_F026,well thats a good reason but it dont mean a thing i mean you havent seen her since you went to war its been five years,neu
Ses05M_script01_1b_F028,now whats going to happen to your father do you know i dont,sad
Ses05M_script01_1b_M031,ive given it three years of thought i had hoped if i waited dad wouldve forgotten him by now and we could have a a regular wedding and everybody happy,ang
Ses05M_script01_1b_M032,but if that cant happen then ill just get out,ang
Ses05M_script01_1b_M033,ill get out ill go get married someplace else i ill live someplace else maybe new york,ang
Ses05M_script01_1b_F031,are you crazy,ang
Ses05M_script01_1b_M035,the business the business doesnt inspire me,ang
Ses05M_script01_1b_F033,must you be inspired,ang
Ses05M_script01_1b_M036,yeah id like one hour a day if i have to grub for money all day long id like to go home to something beautiful id like a family id like some kids,ang
Ses05M_script01_1b_F034,you dont want to think like that,ang
Ses05M_script01_1b_M040,well i am thinking like that,ang
Ses05M_script01_1b_M041,no you dont im a pretty tough guy,ang
Ses05F_script03_2_F000,you knew there was nothing in that,neu
Ses05F_script03_2_F001,only a trivial little broach,neu
Ses05F_script03_2_F003,you worked the whole thing up in your jealous imagination,neu
Ses05F_script03_2_M004,you must admit that he was in love with you wasnt he,ang
Ses05F_script03_2_F004,maybe just a little but,neu
Ses05F_script03_2_M005,you let him kiss you you said you did,ang
Ses05F_script03_2_F005,and what of it,neu
Ses05F_script03_2_F006,well i he got a lot of pleasure out of it and it didnt hurt me,neu
Ses05F_script03_2_M008,well thats a nice point of view i must say,ang
Ses05F_script03_2_M009,so am i bored stiff would you like some brandy,neu
Ses05F_script03_2_M010,ill have a little i think,neu
Ses05F_script03_2_F010,i dont see why you want any youve already had three glasses,neu
Ses05F_script03_2_F011,well it seems silly to go on and on in such a thing,neu
Ses05F_script03_2_F012,its becoming a habit with you,neu
