Utterance_ID,Text,Emotion
Ses02M_impro02_F004,its dangerous i mean how can you make sure that youll,sad
Ses02M_impro02_F005,i hope so,sad
Ses02M_impro02_F006,i hope so,sad
Ses02M_impro02_F007,its going to be really rough,sad
Ses02M_impro02_M007,you gotta take care of our baby for me alright,sad
Ses02M_impro02_F008,ill send you lots of pictures,sad
Ses02M_impro02_M008,i hope so because im not going to be able to survive without all that i dont know what im going to do,sad
Ses02M_impro02_M009,ive never been  ive never been away from you for two weeks let alone a year,sad
Ses02M_impro02_F009,well just promise me that you going to be safe,sad
Ses02M_impro02_F010,i mean cant they put you in like you know kitchen work or something where you wont get,sad
Ses02M_impro02_M013,theres people that thought it was the right thing to do so now we have to we have to do what we have to do for our country,sad
Ses02M_impro02_M014,and itll work out you know go there and do that yeah ill be back,neu
Ses02M_impro02_F012,will you write me letters paper ones,sad
Ses02M_impro02_F013,our baby needs a dad you cant leave okay you cant disappear,sad
Ses02M_impro02_M017,our baby has a dad alright daddy is going to be back soon,sad
Ses02M_impro02_M018,i want you to you know take lots of video pictures and i can see you when i get back or while im there im going to miss you,sad
Ses02M_impro02_F014,ill miss you too,sad
Ses02F_script02_1_M000,what time is it theyre supposed to run around midnight,hap
Ses02F_script02_1_M001,this is great isnt it look at the night weve got here couldnt be better,hap
Ses02F_script02_1_M002,i would have liked to have gone a little further up the coast to get away from the lights and the people but i was afraid wed miss it,hap
Ses02F_script02_1_M003,how you doing,hap
Ses02F_script02_1_M004,is thatnois that just foam i cant even tell,hap
Ses02F_script02_1_M005,well i guess we can tell it probably isnt right probably be unmistakable dont you think,hap
Ses02F_script02_1_M006,how you doing aw you know what i forgot i forgot to bring my flashlight oh how could i be so stupid i shouldve brought my flashlight,hap
Ses02F_script02_1_F001,what flashlight,neu
Ses02F_script02_1_M009,oh well sure,neu
Ses02F_script02_1_M010,right of course our flashlight mine and yours i mean me flashlight is su flashlight naturally,neu
Ses02F_script02_1_M012,i wonder do they always run during a full moon i cant remember if it was full last year do you remember,neu
Ses02F_script02_1_F005,yeah,neu
Ses02F_script02_1_M013,you cold do you want my jacket oh we shouldve brought the blanket our blanket,neu
Ses02F_script02_1_M014,this is great isnt it a six pack would be just the ticket right now,hap
Ses02F_script02_1_M015,i cant believe i forgot im like a kid its amazing i got out of the house with my fly zipped,hap
Ses02F_script02_1_M016,you think they can hear us talk or feel the vibrations in the sand when we move around,hap
Ses02F_script02_1_M017,do you want my jacket,neu
Ses02F_script02_1_M019,right,neu
Ses02F_script02_1_M020,thats my point too,neu
Ses02F_script02_1_M021,no no thats not my point the point is theres no point in coming down if we just leave dont you want to see it,neu
Ses02F_script02_1_M024,think about the people in kansas they had to get plane tickets and hotel reservations to see this we live forty minutes away its too good to pass up,hap
Ses02F_script02_1_M025,yeah but that moment on the beach is the highlight of their little lives all that flopping is laying eggs or what do youspawning or mating i mean,hap
Ses02F_script02_1_M026,this is a big night for these guys lifes last orgy,hap
Ses02F_script02_1_M028,alright but its fish that do something that none of the other fish do like the swallows returning to capistrano or the lemmings throwing themselves off the cliffs,hap
Ses02F_script02_1_M031,i dont get it the first time we came here you said it was the best night of your life,neu
Ses02F_script02_1_M033,we werent in a good spot,neu
Ses02F_script02_1_F019,we didnt see them the first time either,neu
Ses02F_script02_1_M035,there is thatno thats just seaweed isnt it,hap
Ses02F_script02_1_M036,oh man this is great isnt it i wouldnt miss this for anything here think about this all right i know youre not interested but think about this,hap
Ses02F_script02_1_M039,all as one this time release instinctual little firecracker went off and they all turned and formed a line as long as the california coast and started swimming and theyre swimming right now as if thats all that matters,hap
Ses02F_script02_1_M040,its like single mindedness with no mind its urgency thats pure urge they dont know what drives them they dont ask it a question or give it a name,hap
Ses02F_script02_1_M041,they just turn as one and start the swim that brings them right here to where we stand for a massive celebration of sex and death,hap
Ses02F_script02_1_M042,ah god im giving myself goose bumps look all my hairs are popped up,hap
Ses02F_script02_1_M043,well so what do you think,neu
Ses02F_script02_1_F021,about what,neu
Ses02F_script02_1_M044,what i was saying,neu
Ses02F_impro08_F000,hi my name is shiloh welcome toairline six hi how may i help you,neu
Ses02F_impro08_F001,all right sir,neu
Ses02F_impro08_F002,i completely understand automated systems are very difficult sometimes,neu
Ses02F_impro08_M003,okay,neu
Ses02F_impro08_F003,um how may i help you youre trying to book a specific flight,neu
Ses02F_impro08_F004,oh yeah absolutely you know and especially because youve been waiting so long and i know that um youve been having a difficult time,neu
Ses02F_impro08_F005,i want to definitely give you our special package today which um is usually only for valued customers who have a record of having previous,neu
Ses02F_impro08_F006,um lots of purchases but were gonna go ahead and give that to you anyway uh just to make sure that youre happy with your service here,neu
Ses02F_impro08_M005,you you can do thatyou can do that now i dont have to get like transferred through or anything like that,neu
Ses02F_impro08_F007,is that all right,neu
Ses02F_impro08_F008,i can do that right now for you no absolutely i can take care of you all the way through to the end,neu
Ses02F_impro08_F009,all im going to need is your credit card number but just give me one moment so,neu
Ses02F_impro08_M006,breathing thats good,neu
Ses02F_impro08_F010,um youre scheduling a flight as welland you would like to um we have a highly discounted hotel rate that goes along with that so that everything is all in one deal youre taken care of by the time that you get there,neu
Ses02F_impro08_M007,all right i want to make sure its like a nice hoteli meanmean im gonna be paying a lot of money for this so i dont wannai dont wanna you know i dont wanna to be a waste of time,neu
Ses02F_impro08_F011,absolutely we we,neu
Ses02F_impro08_F012,yes i completely understand actually ourour airline only uses five star hotel and above except we charge at a three star hotel rate because as a corporation we are able to get a deal from the hotels themselves,neu
Ses02F_impro08_F013,so you will absolutely be in a high rated great hotel and we can make sure that its in a area of town that you like as well,neu
Ses02F_impro08_M008,okay so,neu
Ses02F_impro08_F014,yeah,neu
Ses02F_impro08_M009,well you know we wanted towe wanted to go to maui andthat was a,neu
Ses02F_impro08_F015,okay,neu
Ses02F_impro08_M010,you know the kids wanna go to the beach and stuff and soum,neu
Ses02F_impro08_F016,great how many seats,neu
Ses02F_impro08_M011,well its gonna be four of them,neu
Ses02F_impro08_F017,okay great four seats ill book you for four seats,neu
Ses02F_impro08_M012,all right and can they like all get together,neu
Ses02F_impro08_F018,oh yeah absolutely um would you like window seats or aisles,neu
Ses02F_impro08_M013,um you know window is nice i guess,neu
Ses02F_impro08_F019,okay i can do um a win two like a window and a aisle and a window and an aisle next to each other so that each of you can sit two by two and switch around maybe,neu
Ses02F_impro08_F020,okay great what time of the day would you like,neu
Ses02F_impro08_M015,uh well yeah i think we were justyou know whenever best available i guess you know,neu
Ses02F_impro08_F021,all right great well we have a very open flight that leaves at nine am and fortunately uh the time change actually goes um backwards from that,neu
Ses02F_impro08_F022,so its a five hour flight but youll arrive only at eleven a clock in the morning so that day you can have plenty of time to get to your hotelrest up and then still have a nice afternoon your first afternoon in maui,neu
Ses02F_impro08_M016,and like theres theres shuttles or something that i can get to the hotel,neu
Ses02F_impro08_F023,absolutely that actually goes in on the same package with our hotel you just give me your address well come and pick up a time that allows you to get to your flight with plenty of time to spare,neu
Ses02F_impro08_F024,and a there will also be a shuttle waiting for you to take you to the appropriate hotel,neu
Ses02F_impro08_F025,yeahi completely understand its a difficult process sometimes and we want to make traveling as easy as possible,neu
Ses02F_impro08_M018,all right so were confirmed then or do youall right,neu
Ses02F_impro08_F026,absolutely thank you so much for calling and we hope that you will come to us again,neu
Ses02F_impro08_M019,okay,neu
Ses02F_impro08_F027,thank you,neu
Ses02F_impro07_M000,so hows it going,neu
Ses02F_impro07_M001,oh you got what where,hap
Ses02F_impro07_F001,i got into usc,hap
Ses02F_impro07_M002,oh no way,hap
Ses02F_impro07_F002,yeah im so excited so im gonna say,hap
Ses02F_impro07_M003,are you gonna go you gonna,hap
Ses02F_impro07_F003,yeah i think i mean because where else would i gonna go like the other places that i applied to i really didnt like that much anyway,hap
Ses02F_impro07_F004,so,hap
Ses02F_impro07_M004,wow thats,hap
Ses02F_impro07_M005,thats first choice huh thats so awesome and now look youre gonna beyoure gonna be here you know,hap
Ses02F_impro07_F005,yeah i know,hap
Ses02F_impro07_F006,absolutely im so excited,hap
Ses02F_impro07_F007,i know i know and well all get to hang out and imeven though well be at like at different parts of the city we can still like,hap
Ses02F_impro07_F008,hang out and like have our different livesand meet each others friends and stuff so im just so glad cause they have such a good school,hap
Ses02F_impro07_M006,yeah no definitelyits gonna,hap
Ses02F_impro07_M007,yeah,hap
Ses02F_impro07_F009,and like the football teamand like all theyou what i mean like,hap
Ses02F_impro07_M008,yeah,hap
Ses02F_impro07_M009,fight on,hap
Ses02F_impro07_F010,you can walk somewhere and be anywhere in the country and be like oh yeah i am at usc,hap
Ses02F_impro07_F011,and you know what you know what i mean like its recognizable rather than just being like i went some random school its like people really know what you,hap
Ses02F_impro07_M010,laughter,hap
Ses02F_impro07_M011,wow thats cool,hap
Ses02F_impro07_F012,like they feel likei feel like its going to be so like accomplished do you know what i mean,hap
Ses02F_impro07_F013,like it has some prestige so,hap
Ses02F_impro07_F014,yeah i mean theres all the money stuff and my moms helping me with the financial aid and stuff but itll be fine,hap
Ses02F_impro07_F015,like now that im accepted its just like such a huge load off my mind,hap
Ses02F_impro07_F016,i dont mind worrying about all the paperwork you know,hap
Ses02F_impro07_M016,so,neu
Ses02F_impro07_F017,because i dont have to like make that decision anymore i dont have to try and decide like what the bad school im going to go to is you know,hap
Ses02F_impro07_M017,right right right oh man then youre going to have to do orientation i guess,hap
Ses02F_impro07_F018,i know i know i think you go and you like stay for a couple of days and you meet people andand theyll give you like a tourand show you everything oh man im just soim so excited,hap
Ses02F_impro07_M018,thatll be awesome,hap
Ses02F_impro07_M019,i mean because you went to the campus before right,hap
Ses02F_impro07_F019,yeah oh totally its a beautiful campus its gonna be really nice um and everyone is friendly and like theres ivy on all the walls oh its just soits so like collegiate,hap
Ses02F_impro07_F020,you know what i mean like its like exactly what i want,hap
Ses02F_impro07_F021,well you know ive thought about it but they have so many things that i mightlike try some things out first,hap
Ses02F_impro07_F022,because also on the list of their um like ges or whatever you have a lot of choices within every single one so you can like try things out and not just be like oh i have to take math oh i have to take this you know what i mean,hap
Ses02F_impro07_F023,so um so i dont know,hap
Ses02F_impro07_F024,i mean im gonna take a bunch of stuff and see,hap
Ses02F_impro07_M023,oh man,hap
Ses02F_impro07_F025,i they have likethey just have so many like prestigious like this school is top ten and like the departments within it you know what i mean,hap
Ses02F_impro07_F026,i know i get to be one of those nowill like walk around and be like a usc you know what i mean,hap
Ses02F_impro07_M027,ahh yeah garbage,hap
Ses02F_impro07_M028,youll be like are you a fan or a student you know student laughter oh man thats awesome,hap
Ses02F_impro07_F027,and youll be like,hap
Ses02F_impro07_F028,student im a student yes i am thank you very much,hap
Ses02F_impro07_F029,breathing,hap
Ses02F_impro07_M029,a usc graduate now youre set,hap
Ses02F_impro07_F030,i know im excited,hap
Ses02F_impro07_F031,well thatll take a while garbage,hap
Ses02F_impro07_F032,thats going to be a lot of work,hap
Ses02F_impro07_F033,but itll be fine i mean im so excited its going to be so fun,hap
Ses02F_impro07_F034,i know and i mean the areas not great but like the school makes up for it itll be fine itll be good,hap
Ses02F_impro07_M034,youre getting close to the beach i mean geez,hap
Ses02F_impro07_F035,i know i know so fun i cant wait,hap
Ses02F_impro07_F036,i will i will thank you,hap
Ses02F_impro07_F037,thanks,hap
Ses02F_impro06_M000,hey a whats up,neu
Ses02F_impro06_F000,um johnny died yesterday,sad
Ses02F_impro06_M001,wow thats horrible,neu
Ses02F_impro06_M002,im sorry to hear about that,neu
Ses02F_impro06_F001,we knew that it was coming but,sad
Ses02F_impro06_M003,yeah,neu
Ses02F_impro06_F002,it seemed like he had a little bit longer like just last week he was doing was so well,sad
Ses02F_impro06_M004,i mean you know at least hes not in anymore pain now right,neu
Ses02F_impro06_F003,yeah,sad
Ses02F_impro06_M005,its good you know you know it hurts i know i know what its like to lose someone like that,neu
Ses02F_impro06_F004,i just dont want him to be gone,sad
Ses02F_impro06_M006,its okay,neu
Ses02F_impro06_M007,cause you know youve got all the times that you guys did spend together you know and thats something good that you can look back on,neu
Ses02F_impro06_M008,i meani dont know,neu
Ses02F_impro06_F005,and his whole family was there,sad
Ses02F_impro06_F006,i mean he was like really conscious right up until the end you know,sad
Ses02F_impro06_M009,well thats thats good you know at least i dont know i mean its its better to go to goout that way than,neu
Ses02F_impro06_M010,than you know in pain and like this gradual this horrible process i mean,neu
Ses02F_impro06_F007,he was so young you know and all the stories he used to tell me about,sad
Ses02F_impro06_F008,the way he wanted to live and he was gonna go to africa and he was gonna,sad
Ses02F_impro06_M011,but look at thehelook at the life he did get to lead i mean for his age hed done so much and,neu
Ses02F_impro06_F009,nobodys ever gonna forget him,sad
Ses02F_impro06_M012,yeah exactly hes made a big impact on a lot of people and,neu
Ses02F_impro06_M013,and youll always have that andyou should feel you know happy for him that he got to do so much beforei mean and even after he found out last year i mean,neu
Ses02F_impro06_F010,he did a lot but,sad
Ses02F_impro06_M014,i know it doesnt bring him back but,neu
Ses02F_impro06_M015,but its okay because now you know youll just go on with your life and,neu
Ses02F_impro06_F011,im gonna forget him,sad
Ses02F_impro06_M016,no youll never forget him,neu
Ses02F_impro06_F012,i wont be able to hear his voice or his,sad
Ses02F_impro06_M017,i know but youre not i mean youre not going to forget him the pain will go away eventually andor it will subside,neu
Ses02F_impro06_F013,you start to lose like that image after a while,sad
Ses02F_impro06_M018,that will be itll beitll be better that way i mean time will tell time heals you know and its good its okay i mean it wasnt anybodys fault or anything like that so ,neu
Ses02F_impro06_M019,its hard to lose someone that way but hes hes betterhes better off now,neu
Ses02F_impro06_F014,thanks,sad
Ses02M_impro06_M000,kathy died last night,sad
Ses02M_impro06_M001,yeah i mean you know it was a ,sad
Ses02M_impro06_M002,i guess we saw it coming and she lasted a lot  a lot longer than uh they expected but you know i mean when it actually happens its just a lot harder,sad
Ses02M_impro06_F002,it doesnt make any easier yes,sad
Ses02M_impro06_M003,i mean at least she was home she wasnt in the hospital anymore,sad
Ses02M_impro06_F003,oh man im so sorry,sad
Ses02M_impro06_M004,she was with yeah she was with gary and he said that she was just sitting there and went to sleep closed her eyes and that was it,sad
Ses02M_impro06_F004,its going to be so rough im sorry,sad
Ses02M_impro06_M005,yes i mean its not as rough on me as it is on him but,sad
Ses02M_impro06_M006,god its you know weve spent so much time with them its just really surreal really weird that were not going to be able to see her anymore and go,sad
Ses02M_impro06_F005,yeah,sad
Ses02M_impro06_M007,out to out to dinner you know and do the troops to california i mean,sad
Ses02M_impro06_F006,totally,sad
Ses02M_impro06_M008,its just that i dont know its sort its sort of a weird thing you know,sad
Ses02M_impro06_F007,yeah,sad
Ses02M_impro06_M009,not being able to see anyone again who knows where they really went you know i mean i guess we can just hope that wherever they are now if its anywhere that its better i mean,sad
Ses02M_impro06_F008,yes well at least you have a lot of good memories,sad
Ses02M_impro06_M010,she was garbage,sad
Ses02M_impro06_F009,she really cared about you you know,sad
Ses02M_impro06_M011,yes i mean she cared about all of us she was great,sad
Ses02M_impro06_M012,so loving everybody you know,sad
Ses02M_impro06_F010,and she was,sad
Ses02M_impro06_M013,gosh i just hate i just hate to see her go,sad
Ses02M_impro06_F011,yeah,sad
Ses02M_impro06_M014,we were all going take a trip to europe you know,sad
Ses02M_impro06_F012,even if you still do shell shell be there,sad
Ses02M_impro06_M015,yes breathing god,sad
Ses02M_impro06_F013,are you going to be okay,sad
Ses02M_impro06_M016,i just  i just dont get it like there is just nothing you can do about it you know its like just out of your control and it,sad
Ses02M_impro06_M017,just makes it that much harder to deal cause as much as you want to you know make her better see her not in any pain its like just i dont know just has a mind of its own,sad
Ses02M_impro06_M018,then shes gone,sad
Ses02M_impro06_F014,its going to be okay i promise,sad
Ses02M_impro06_M019,well you know i appreciate you coming over and talking to me i mean it definitely helps,sad
Ses02M_impro06_F015,sure,sad
Ses02M_impro06_M020,to talk to somebody but,sad
Ses02M_impro06_F016,you shouldnt be alone,sad
Ses02M_impro06_M021,its just going to take a while i think,sad
Ses02M_impro06_F017,yes,sad
Ses02M_impro06_M022,ah,sad
Ses02M_impro06_M023,thank you,sad
Ses02M_impro06_F018,yes,sad
Ses02F_script03_2_M000,as a matter of fact the real cause of that row was peter burden,neu
Ses02F_script03_2_M001,i knew nothing of the sort you took presents from him,neu
Ses02F_script03_2_M006,what of it,ang
Ses02F_script03_2_M007,well what about me,ang
Ses02F_script03_2_F007,well if you hadnt been so suspicious and nosey you never would have known a thing about it,neu
Ses02F_script03_2_M009,me too bored stiff you want some brandy,neu
Ses02F_script03_2_M011,no particular reason anyhow they were very small ones,neu
Ses02F_script03_2_F011,just seems so silly to go on and on and on with such a thing,neu
Ses02F_script03_2_F012,well its become a habit with you,neu
Ses02F_script03_2_M013,you neednt be so grand just because you dont happen to want any yourself at the moment,ang
Ses02F_script03_2_F013,dont be so stupid,ang
Ses02F_script03_2_F014,what,ang
Ses02F_script03_2_F016,a womans job is to allure the man watch me a minute will you,hap
Ses02F_script03_2_F018,oh be quiet,ang
Ses02F_script03_2_F020,adders dont snap they sting,ang
Ses02F_script03_2_F025,youre quite insufferable,ang
Ses02F_script03_2_M027,im not in the least drunk,ang
Ses02F_script03_2_F029,shut up,ang
Ses02F_script03_2_M030,we could get a good debate going about this dont you think intemperate tots,ang
Ses02F_script03_2_F031,why,ang
Ses02F_script03_2_F034,turn it on again please,ang
Ses02F_script03_2_M036,ill do no such thing,ang
Ses02F_script03_2_F035,very well if you insist on being boorish and idiotic,ang
Ses02F_script03_2_M037,turn it off its driving me mad,ang
Ses02F_script03_2_F036,you are far too temperamental try to control yourself,ang
Ses02F_script03_2_M038,turn it off,ang
Ses02F_script03_2_F037,stop it go away i hate you,ang
Ses02F_script03_2_M039,amanda listen listen,ang
Ses02F_script03_2_F038,listen listen indeed i am sick and tired of listening to you damn sadistic bully,ang
Ses02F_script03_2_F039,i hate you stop it stop it i hate you do you hear youre conceited and overbearing and utterly impossible,ang
Ses02F_script03_2_M041,youre a vile tempered loose living wicked little beast and i hope to never see you again as long as i live,ang
Ses02F_script03_2_F040,this is the end finally and forever do you hear me the end,ang
Ses02F_script03_2_M042,youre not going like this,ang
Ses02F_script03_2_F041,oh yes i am,ang
Ses02F_script03_2_M043,youre not,ang
Ses02F_script03_2_F042,i am let go of me youre a cruel fiend and i hate and loathe you,ang
Ses02F_script03_2_M044,shut up shut up,ang
Ses02F_script03_2_M045,i wouldnt i wouldnt marry,ang
Ses02F_script03_2_M046,i wouldnt marry you if you came in crawling on your knees,ang
Ses02F_script03_2_F043,thank god i realized what you are id never marry you again ever in my life youre a cruel fiend and i hate you youre a beast youre a beasti hate you stop it stop it,ang
Ses02F_script03_2_M047,youre a evil vampire and i hope to god i never see you again as long as i live,ang
Ses02F_impro05_F000,hi um excuse me i believe that the airline lost my baggage,neu
Ses02F_impro05_M000,um okay it didntdidnt come out on the carrousel,neu
Ses02F_impro05_F001,no it didnt um it didnt come out and i dont see it anywhere around here so what can you do about that,neu
Ses02F_impro05_M001,okay um well unfortunately yeah there was a some some problems with the,neu
Ses02F_impro05_M002,uh well somesome of the bags werewere lost on the way over here uh,neu
Ses02F_impro05_M003,you know i mean theres a lot of things that go on under the plane and sometimes you know that kind of things happen,neu
Ses02F_impro05_M004,uh but we are willing to reimburse you for the bag and and for the contents,neu
Ses02F_impro05_F004,how much,neu
Ses02F_impro05_M005,um wed be willing to give you uh fifty dollars for,neu
Ses02F_impro05_M006,right uh we realize you know that that its a bad situation but im sorry theres nothing that we can really do,neu
Ses02F_impro05_F006,thats all thats all thats all youre going to do is just give me fifty dollars and say go have fun on your vacation without any of your stuff,ang
Ses02F_impro05_M007,i think um maybe you can file a claim if you want and turn it in to our main office,neu
Ses02F_impro05_M008,right no i mean they they mightthey mightif youif you are argue the case more maybe theyll reimburse you more but right now,neu
Ses02F_impro05_M009,yes i know i know its its frustrating unfortunately though um,neu
Ses02F_impro05_F010,because you dont seem to care very much you know,ang
Ses02F_impro05_M010,by checking your bags youyou you know admit to the liability thats thats at risk,neu
Ses02F_impro05_M011,right well by checking in your bags you agreed to you know at the will of the,neu
Ses02F_impro05_M012,you paid for the flight and then your bags were checked atits a service that the airline provides for us so so really its really the risk was taken and im sorry but theres really nothing else we can do so do you wantdo you want the reimbursement,neu
Ses02F_impro05_M013,well there arethere are some shops here in in the airport,neu
Ses02F_impro05_M014,no um like i said you can file a claim and uh maybe get reimbursed for more you,neu
Ses02F_impro05_M015,probably even talk to,neu
Ses02F_impro05_M016,right thatthat gets taken care of that gets taken care of we get we do you know we investigate those and just make sure that um theyre not doing their own thing with them souh,neu
Ses02F_impro05_M017,but unfortunately sometimes is,neu
Ses02F_impro05_M018,well thatsthats what im saying,neu
Ses02F_impro05_M019,okay well that that could be something that you put on on the claimon on the complaint form if you want and provide us with your information while youre here and then maybe if it turns up then well send it right over,neu
Ses02F_impro05_F019,it sounds like its such a little like oh well no big deal whatever its a big deal to me,ang
